,Comment,Label
723,Phim nào cũng báo kinh phí 200-250m$ mà cuối cùng kĩ xảo lẫn kịch bản đều thua godzilla minus one có 15m$. Đúng là tư bản dư tiền càng ngày càng chán,negative
724,"Chính xác là quá hụt hẫng so với kỳ vọng rất nhiều. Đặc biệt la cái việc bỏ đi ngũ hiệp mà lại thêm vào cái việc hai ông già đi tìm con, trong khi Po đã quá trưởng thành, mấy phần trước trong khi Po vẫn còn chưa hoàn thiện thì cũng chưa thấy hai ông già lo như z, chi tiết đó quá thừa,",negative
725,"1 triplogy có 2 quy luật
Thứ nhất, phần 2 luôn là phần hay nhất
Thứ hai, chỉ cần ra phần 4 là dở tệ",negative
726,"nếu phân đoạn đánh phản diện theo 1 kịch bản khác, thì có lẽ đã khác, phản diện mới đầu debut mạnh mẽ, lãnh thụ tinh hoa của tất cả các võ sư nhưng chỉ thua sau đúng 1 đòn thần long đại hiệp của 1 cô cáo mới học chiêu được 3 ngày. Rất là nhạt!!!",negative
727,Tôi đã ngồi xem credits và tôi thấy có Jimmy (mr.beast) trong credit kung fu panda 4,neutral
728,"về mặt giải trí thì phim làm tốt, cả gia đình đi xem phim thì hợp lí",positive
729,Liệu có kung fu panda 5 không ad ơi 😢,neutral
730,Vắt hết sữa rồi..,negative
731,"Phần này cái kết quá lãng xẹt, nhân vật Zhen tưởng là chính mà lại như phụ, mọi biến chuyển của nhân vật đều cực kì khó hiểu và vội vàng",negative
732,Nói chung là kungfu Panda hay nhất là phần 1 thôi mấy phần kia không còn hay lắm,negative
733,"kêu phim hài còn nhẹ =]] 2/3 đầu phim như mớ hỗn độn , phần cuối phim thì thui , nói mớ hỗn độn thì nhẹ quá , xem mà chán gì đâu , chắc kungfu panda chỉ có 2 phần :)) 3 4 ko đáng gọi là kungfu panda",negative
734,"Lúc đầu xem mọi người chê cũng rén nhưng mà ra rạp chả phim nào coi cả nên xem đại. Xong kiểu bị wow luôn vì phim giải trí cực mà mn chê hơi nặng lời, đúng là phần cuối đánh nhau hơi ít chắc do kinh phí tèo hơn mấy phần trc nhưng mà phần này thấy giải trí nhất trong all các phần lun ấy",positive
735,đam mê kungfu mà sau khi hấp thụ 1 đống kungfu cái đi biến thành con quái vật vô tri :))),negative
736,"mình cảm giác như phân đoạn bà Tắc Kè trở thành một mớ hổ lốn bẹo hình bẹo dạng nó như nói lên cái việc khi mà con người ta tham lam quá, cái gì cũng muốn mang vào người thì cuối cùng sẽ là ""biến tướng, biến chất"" đúng nghĩa đen lẫn nghĩa bóng luôn.",negative
737,"kết cái câu ""kungfu panda chưa bao giờ chỉ đơn thuần là một bộ phim giải trí"". cái đó mới là thứ khiến t muốn xem rạp chứ nếu chỉ đơn thuần là hài hước thì thôi đơi khi nào lên web rồi xem vui vui cũng đc",neutral
738,phim hay nè,positive
739,Từ phần 3 đã thấy không còn hay rồi. Phần này hút máu là chủ yếu. Lãng phí,negative
740,"Mình không đánh giá cao phần này , nó giống bị vắt sữa hơn là một bộ tiền truyện , cảm giác hơi phí tiền 😢(ykr)",negative
741,"Sai lầm khi chọn xem bản thuyết minh, dùng toàn ngôn từ của VN, chán",negative
742,"Cảnh final battle xem như Po nhường phản diện ý, còn Zhen thì tự nhiên múa đc chiêu của cây trượng thì đúng kiểu wtf luôn. Từ đầu gặp phản diện nếu lấy lại đc cây trượng Po dùng trượng đập luôn thì combat này đúng 1 phút endgame",negative
743,"Theo nhận xét của tớ , panda dành cho trẻ em nên với tôi thì cái kết khá nhanh và cũng không động lại.nhưng cái kết ấy,tớ đã thật sự thấy 1 pô khác không phải một pô vụng về cũng không phải 1 pô lười nhát,kiểu nó cho thấy pô trưởng thành hơn hẳn yyy.với phân cảnh cuối bộ 5 quay về xúc động vãi",positive
744,Đối với mình xem từ phần 1 đến phần 4 thì có hơi chút hụt hẫng nhưng nhận ra phim này dành cho trẻ en nên cũng thấy bình thường,neutral
745,"Tôi đã xem cả 3 phần trước nhiều lần (có cả DVD và web), sau khi xem phần 4, cơ bản: phim vẫn vui vẻ, xem lồng tiếng của nhóm Đạt Phi rất tuyệt, nhiều câu chuyển thể vần điệu rất trend. Dù màn combat cuối chưa được mãn nhãn cho lắm, nhưng vẫn là đúng chất Kungfu Panda, vẫn có tính giáo dục, vẫn là hướng thiện thắng ác.
Thông điệp phim vẫn có: dù ta giỏi thế nào, thì đến 1 thời điểm nào đó, nên nhường lại vị trí đó cho người khác kế thừa, và chuyển qua hỗ trợ cho họ. Bài học lớn dành cho những kẻ tham quyền cố vị. Bên cạnh đó, đó chính là ""gậy ông đập lưng ông"" với việc sử dụng 3 nguyên tắc của kẻ phản diện để diệt nó.
Chỉ tò mò là credit giai điệu Baby One more time vang lên có ý đồ gì đây?
Với mình thì có lẽ serie này đã đến lúc kết thúc. Khi xem, đúng là cảm giác hơi thiếu thốn, hụt hẫng, chuyển biến nhanh quá.",positive
746,nên để gấu trúc tìm tình yêu của minh như vậy còn có cái khai thác,neutral
747,Phim này theo tui thì chỉ hài với ấn tượng bài Baby one more time thuiii chứ kiểu đánh bại con tắc kề nhanh quá=((( Tui kiểu hơi hụt hẫng ấy tại nó hút hết linh hồn của mấy ô kia rùi mà bị đánh bại nhanh vc=)) Nhm với những người chưa xem p1 p2 p3 thì chắc sẽ thấy hay ( YKR),negative
748,Ông Jack Black đúng hài 😂,positive
749,"Vắt kiệt rồi 😢,ko thấy wow như kungfu 1",negative
750,Po có quá trẻ để truyền ngôi ko???,negative
751,"Phim không dở do chúng ta lớn quá nhanh, quá để ý tiểu tiết. Chúng ta hãy nhìn những đứa con, em chúng ta xem các bé cười khoái chí rồi hẳn đánh giá",neutral
752,Đơn giản tên phim là kunfu panda chứ không phải là kunfu zen-chan 🤣🤣,neutral
753,"Lúc xem phim t mang theo tâm thế là phim hoạt hình dành cho trẻ em và cũng từng xem hết cả 3 phần phim trc thì t thấy phim cũng ổn mà nhỉ, vượt hơn cả kì vọng của t, đối tượng phim hướng đến là trẻ em nên ng lớn nên có cái nhìn thoáng hơn về bộ phim chứ ạ. Lúc t đi xem chắc phải full rạp là trẻ em, tất cả đều hoan hỉ vui vẻ vì mấy trò vô tri của Po😂",positive
754,"Thế quái nào mà Kai có thể hiện về được nhỉ :)))
Po cho hắn bay màu trong linh giới ở phần 3 rồi mà",neutral
755,sao mn chê vậy 😢 Mình thấy phim rất hay,positive
756,"phim vui , giải trí khá ổn",positive
757,sữa nhạt toẹt,negative
758,Phim vắt sữa đỡ nhất trong những phim bị vắt sữa tui từng thấy 👌🏻,negative
759,"Từ lúc thấy phản diện, trong đầu mình đã nghĩ kịch bản sẽ kiểu như phản diện hoá thân rồi lừa để chia rẽ, làm lục đục nội bộ các thứ. Nghĩ v xong mình lại tự cười vì nghĩ phim cho trẻ con thì cái plot đó cx quá dark và hơi khó để solve problems rồi. Ai dè cái plot và hướng hành động, suy nghĩ của phản diện nó như 1 trò hề luôn 🙂",negative
760,Họ đang cố vắt sữa từ một con bò già . Để rồi  ko còn sữa họ lại mổ nó ra để lấy ít thịt khi mà con bò chỉ còn ra bọc xương.,negative
761,"Bộ phim nên cho gấu trúc có thêm 1 đứa con. Sau đó đứa con sẽ làm cái bóng của cha. Bị thât bại và kungfu lại biến mất. Đến một thời điểm nào đó, biến cố nào đó giúp đứa con tìm ra bản ngã của mình và ....😁😁😁😁",neutral
762,"Phần 4 thật sự là không hề chỉn chu tí nào, trong khi đơn cử là phần 3 đến giờ xem lại cảnh làng gấu trúc cứu Po mà xúc động muốn khóc thì phần 4 này chẳng có gì đọng lại. Tất cả câu chuyện của tất cả nhân vật đều sơ sài, xử lý qua loa và bị gom chung vào nồi rồi đảo đều như cháo vậy. Tiếc nhất là phản diện Pháp sư Tắc Kè có rất nhiều điểm có thể khai thác nhưng cuối cùng còn không thể nào đứng chung mâm với những phản diện mùa trước.",negative
763,"T vừa xem xong và thật sự là thất vọng, nhất là cảnh đánh nhau ở cuối, quá ngắn, quá vội vàng, thực sự là ko có j để nói",negative
764,"Nói thật nhé, phản diện chính của bộ phim này hoàn toàn có cơ hội để trở nên cực kỳ nguy hiểm, ko hiểu sao nhà làm phim lại lãng phí vậy. Một người có thể biến thành hình dạng các nhân vật khác mà không dùng triệt để sức mạnh đó để thao túng người khác ? Chưa cần đến khả năng hút sức mạnh, chỉ cần muôn hình vạn trạng đã cực nguy hiểm rồi. Đã thế sử dụng sức mạnh hút được cũng chẳng linh hoạt, vừa mới hút xong chưa kịp bung thì đã bị tiêu diệt rồi. Mà nói thật, bả mới kịp cướp cái mỏ sắt à",negative
765,"3 phần trước hay bao nhiêu thì phần này tệ bấy nhiêu
3 phần trước đánh nhau xem đã con mắt thì phần này đánh như phủi bụi
3 phần trước cũng có đạo lí nhưng nó hợp lí, cân đối, còn phần này đạo lí lắm thì vl mà còn kiểu sến sến. nhân vật mới thì thật sự méo có gì là nổi bật. Tuyến truyện của  Phản diện thì  kể qua loa trong vài lời thoại, cũng chẳng có điểm gì nổi bật. Đoạn combat cuối thì cụt ngủn, phản diện thua xàm vd :)),
Là 1 fan của panda từ khi còn nhỏ đến bây giờ thì phải nói quá thất vọng về phần 4 này. Phần này có lẽ chỉ dành cho con nít xem hoặc là những người chưa xem các phần trước thôi",negative
766,"Haizz, tôi đã mong chờ phần mới này như thế nào, các phần trước đã quá hay để mà so sánh với phần này, cả sự đầu tư chỉnh chu từ phần nhạc nền phim, diễn viên lồng tiếng, cốt truyện đều  không bằng các phần trước, hụt hẫng thật sự😢, tới phần 3 đã quá hay rồi mà lại tới phần này...😵‍💫, chắc ô làm phim hết tiền đầu tư😅. Có cách nào để nhà làm phim lắng nghe được những lời phàn nàn, thỉnh cầu hãy đầu tư phim kỹ lưỡng hơn được không? Bao lâu cũng có thể chờ được chỉ mong được bộ phim chất lượng chứ không phải kiểu mỳ ăn liền đi theo thương hiệu như vậy, nếu như vậy thà đừng ra phim còn hơn, please👏",negative
767,"Những gì hay nhất ở trailer rồi. Phim như hạch. Kịch bản lỏng lẻo, nội dung và xây dựng nhân vật quá hời hợt thiếu chiều sâu. Phản diện nhạt nhòa cùng mục đích nhảm shit. Hài hước cũng chả cứu đc vì ko duyên như những phần trước và có phần gượng gạo",negative
768,bây giờ muốn cứu cái vũ trụ này chắc phải làm phim của tailung mới cứu đc,negative
769,"-có lẽ mng đều quên câu nói cũ của ogway rằng nếu như con có một hạt đào con không thể ép nó trở thành cây táo được mà con chỉ có đào mà thôi
-phần 4 thì po và sifu lại nói hãy làm một hạt đào nếu nghĩ kĩ về câu trên của ogway thì sẽ thấy hơi khó chịu với kungfu panda 4 kiểu phần 1 và 4 hơi mâu thuẫn với nhau í sự phát triển của sifu dường như bị thụt lùi",negative
770,boss yếu xìu,negative
771,Chết rồi lôi dậy vắt sữa😊,negative
772,"thực ra Po vs the chameleon vẫn có một vài điểm đối nghịch 
Po khiêm tốn, cải thiện khuyết điểm, cố gắng để đạt tới ước mơ, khát vọng chân chính, trở thành phiên bản độc nhất vô nhị, thay đổi từ bên trong
Còn Tắc Kè lại nhụt chí khi bị chê bai, luôn phải sao chép người khác và khoe mẽ sức mạnh hào nhoáng bên ngoài mà không tự đi lên bằng nội lực của mình
Chính sự đối lập giữa nội lực của Po và Tắc Kè mới tạo ra cuộc chiến thiếu cân xứng như vậy, sao chép không thể thắng được nguyên bản dù có ưu điểm đến đâu đi nữa",neutral
773,bọn làm phim hút máu vl,negative
774,"không nhé các bạn, toàn chiếu lại, phần chính thì nhạt hơn nước ốc, chê",negative
775,Mỗi khi có mùa mới tôi lại đọc lại manga,neutral
776,Đọc hết maga hết hứng xem,negative
777,Manga thì hết từ lâu rồi mà anime thì vẫn vắt thật đều và chậm,negative
778,Bữa mình đi coi mà hơi buồn ngủ nên ngủ 20-25' đầu nhưng phim vẫn chưa qua phần nội dung mới :)) Vì vậy anh em nên chuẩn bị tinh thần.,negative
779,"Cơ bản là truyện này cũng còn cái quái gì để khai thác đâu (còn 2 arc ngắn tũn để đưa lên anime, end thì chán) nên còn vắt đc cái gì thì vắt nốt. N chưa cắt trailer + opening + ending mang đi chiếu rạp là còn may lắm rồi😅",negative
780,"Phim này nó chỉ dành cho fan của nó thôi, phim này chỉ hay với fan và mấy phần đánh nhau chứ nói về nội dung thì đéo hay thật😅",negative
781,"rất chi hài hước là cả movie chiếu trước của mùa 3 và mùa 4 lần này là ufo đã làm trailer và thông báo rõ ràng là movie sẽ ghép 2 tập cuối của mùa trước và tập 1 của mùa mới để chiếu rạp mà có nhiều thành phần ko chịu tìm hiểu đi coi xong bảo mình bị lừa, quá chán đời về mấy thanh niên này",negative
782,biết bộ này có tầm ảnh hưởng nên nó cố làm thêm mọi hình thức để kiếm thêm tiền,negative
783,"Không hiểu sao vẫn thấy những bộ manga ngày xưa như One Piece, Naruto... hay hơn những bộ mới sau này. Thanh gươm diệt quỷ bản thân tôi thấy không hay lắm mà sao được đầu tư nhiều quá, manga, anime, movie, đồ chơi đủ kiểu. 😑",negative
784,"Lừa gì thì lừa
Xem lại ở rạp cũng phê lắm 🤣",positive
785,Lần nào sắp ra phim họ cũng thông báo trước rồi không tìm hiểu thì chịu thôi:)),neutral
786,Ngta đã thông báo trước rồi đây chỉ là bản tạm (recap) Chán mấy thánh cứ không chịu tìm hiểu kỹ thông tin rồi bảo người ta lừa 😌,neutral
787,"trước mình đi coi với suy nghĩ là xem để giết time là chính vì đằng nào cũng đọc xong truyện rồi nhưng vào rạp xem thực sự bị bất ngờ với cảnh xà trụ và phong trụ, chỉ với cảnh 2 anh thể hiện vậy thôi đã ngoài mong đợi của mình luôn rồi",positive
788,Xem xong đến cái đoạn thạch trụ đập tay mà nổi da gà xong kiểu rồi biết anh là người mạnh nhất luôn😂,positive
789,Hụt hẫng thật 😅,negative
790,Mình thích coi series nên để dành tới cuối coi.Năm ngoái thấy phim rạp tưởng phần riêng đi coi thấy chưng hửng. Năm nay không bị lừa nữa,negative
791,Bản thân nội dung bộ manga đã dở rồi,negative
792,"phim này rất hot nè, đáng xem",positive
793,"mặc dù chỉ xem lại pha che'm da`u thượng huyền tứ, nhưng với hình ảnh âm thanh ngoài rạp nó hoành tráng hơn rất nhiều so với xem TV ở nhà ấy.",positive
794,Là 1 người đã đọc xong manga. Nên dù năm ngoái bị lừa thì năm nay vẫn bị lừa tiếp =]],neutral
795,"manga có chút éc mà tụi nó cho ra movie quài, vắt đến nỗi mà cạn mẹ nó việc luôn",negative
796,Sau khi đọc xong truyện và xem hết mùa 1 + 2 thì bộ này nó chả khác gì bộ hạng Z. Nội dung thì chả có cái gì ngoài đánh nhau - hồi tưởng - thắng - về dưỡng thương- làm trò đùa lập đi lập lại xong hết 1 act.  Nói thật đọc boruto đánh nhau còn có chút não chứ chả phải hồi tưởng như bộ này.,negative
797,"T thấy đi coi cũng OK không đến mức phí tiền đâu, nếu là fan cuồng thì nên đi coi",positive
798,"bộ này tính tới hiện tại chỉ có 1 bản Movie duy nhất là chuyến tàu vô tận chiếu rạp năm 2020 thôi, còn lại đều là bản dành cho Fan muốn xem trước tập 1 của phần mới (và chiếu lại 1 phần của phần cũ) vấn đề này trước khi chiếu rạp đã có thông báo trước rồi, do ko tìm hiểu trước mà đi coi thì chịu thôi",neutral
799,"Truyện thì cũng hết =))) movie thì họ phải làm vậy thôi, với cả thông báo hết rồi, không chịu tìm hiểu trước rồi giờ trách ai",neutral
800,"nói thật là bộ này mình drop từ ss2 rồi=))chả ngó ngàng gì luôn,đợt này tụi bạn rủ đi coi cái cũng đi cho vui,nói thật là cũng hơi hơi sốc nhưng mà đồ họa rồi nhạc phải gọi là đỉnh,chủ yếu mình bỏ tiền vì trải nghiệm chứ không vì nội dung nên mình thấy oke",positive
801,Fan bênh ác :),negative
802,Tư bản cào tiền,negative
803,Xem xong bay mất mấy trăm :)))))),negative
804,những đứa nói bị lừa chắc tay nhanh hơn não rồi,negative
805,"ko có điều gì giải thích được việc chiếu lại 1 phần phim đã được public, lừa là lừa thôi chứ giải thích chỉ thêm bực, phần đặc huấn đại trụ cũng ko đầu ko đũa, chưa bao giờ thấy nhà làm phim nào mà lại làm phim chiếu rạp kiểu như vậy",neutral
806,"đọc kĩ tên phim là biết nội dung của phim rồi, nếu muốn đi xem có những phân cảnh hoành tráng đánh nhau với quỷ thì chờ movie sau, còn movie này để chill",positive
807,"Hình như movie kiểu này giống movie overlord, tưởng chiếu phần ngoại truyện mà nội dung lại tổng hợp lại của season",neutral
808,Méo đọc thông tin xong đi coi rồi ngồi khóc. Ngu thì chịu chứ lừa mẹ gì. :))))))),negative
809,Ufotable mà thầu ragna crimson thì má ơi đỉnh khỏi bàn,positive
810,Phí tiền. Ngắn gọn 2 chữ,negative
811,Ra rạp chỉ đợi đc coi khúc thánh inu dạy nezuko nói😂😂,neutral
812,Cái phim củ liz này sau cái phần chuyến tàu vô hạn thì coi thấy chán hẳn.,negative
813,Bị lừa hết 60k tiền phim đớn thật sự,negative
814,nói chung là hút máu fan thoi=)),negative
815,"Xem  5  lần   đoạn nezuko bị nắng thiêu đốt vẫn khóc  sưng mắt  ,chất lượng hình ảnh thì đẹp kinh khủng, cảnh 2 trụ song kiếm đỉnh cao thật, hóng phần 4 tấu hài và vui nhất trong các phần luôn",positive
816,"Đương nhiên là ko bị lừa rồi:-)), nó thông báo từ trước rồi mà. Năm ngoái cũng vậy?!",neutral
817,"phim được hình ảnh với âm thanh bắt mắt bắt tai, cốt truyện bình thường, xem cũng được k xem cũng được",positive
818,Lừa :)),negative
819,Là 1 người đi xem phim rạp không bao giờ xem trailer để cho trải nghiệm nó tròn nhất ( và tùy duyên nữa ) nên cảm thấy may mắn vãi cả lờ vì delay đi coi tới giờ ::),positive
820,Vẫn cứ là đỉnh của chóppppp,positive
821,Ra rạp xem lại cảnh lưỡng lự của Tanjiro thích vch ra. Xong lúc nhạc nổi lên vẫn cảm động như lần xem đầu tiên vậy.,positive
822,"em xem với tâm thế là recap rồi , vì mùa 3 chưa xem nên là xác định xem  cuối mùa 3 thôi, chứ còn phần 4 như là trailer mở rộng rồi , xem xong mùa 3 vẫn khóc xưng mắt :((",positive
823,Dù sao vẫn chỉnh chu hơn năm ngoái nha. Gì mà năm ngoái chèn ending giữa giữa quả đúng là dô duyên,negative
824,Ko phải fan chỉ đi xem chung với fan nhưng thấy phim hay,positive
825,Đứa nào bảo lừa thì chứng tỏ chả xem trước nội dung mà người ta công bố gì :)),neutral
826,Túm lại không đáng đi xem,negative
827,Fan đi xem không kêu bị lừa toàn mấy đứa không xem lên mạng kêu bị lừa 😂,neutral
828,"Cốt truyện như cái quần què
Movie thì lừa lọc, chiếu lại mấy tập đã chiếu trên web 
T không hiểu tại sao cái truyện này lại nổi đến như vậy.",negative
829,"Đối với người Mê Thanh Gươm Diệt Quỷ như em thì ra rạp coi cực kì đáng. Thưởng thực hiệu ứng phải nói đẹp nhất top 1 thể loại Anime hiện nay + thêm âm thanh loa ở rạpi. Em mê tới nổi đang chơi game bản tiếng Anh của Thanh Gươm Diệt Quỷ nữa. 

Ai đang mê thì cứ ra rạp thưởng thức phim vì ko uổng tiền bỏ ra đâu . Còn những phần trước anh em có thể coi trên Netflix để vừa có âm thanh hình ảnh chất lượng và hiểu thêm phim hơn. Coi nghiện luôn đó. Ko thua gì Naruto, 7 viên ngọc rồng và One Piece đâu ❤❤",positive
830,"Mùa trước đã làm như vậy rồi mà, nhưng phải công nhận coi đánh đã con mắt luôn",positive
831,"Mình phải công nhận là kĩ xảo của bộ anime này đỉnh,đỉnh nhất trong các bộ mình từng xem",positive
832,"Phần này animation siêu đỉnh trong 45p tập cuối mình đã trải nghiệm , khuyên tất cả wibu nên xem",positive
833,marvel còn có GOTG 3 và Loki thành công .DC thì làm phim nào phế phim đấy. 2 phim mới rebot vũ trụ mới cũng nát,negative
834,"Phim đáng xem cho những ai thích xem phim đơn thuần giải trí, không quá kỳ vọng sau khi xem phần 1. Còn ai đã xem phần 1 và kỳ vọng ở phần 2 thì thất vọng hoàn toàn. Ước có chiếu lại phần 1 xem thích hơn. Một câu chuyện đơn giản không có điểm nhấn, thế giới Atlantis không lung linh tráng lệ bằng phần một. Phản diện phụ trẻ con, phản diện chính oneshot, chỉ còn lại là cuộc hành trình ngắn ngủi ít cảm xúc và easygame giữa 2 anh em. Thay vào đó ở phần 1 người đồng hành là Mera xem cảm xúc và thích hơn rất rất nhiều. Nữ chính xinh đẹp quá ít xuất hiện cũng là điểm trừ khá lớn :))). Phim 6/10 so với phần một 9/10",negative
835,"Thời ông cha đánh nhau đánh mỏi cả tay mới gẫy đôi được thanh đinh ba đen, đến thời thằng cháu cầm phi cái vỡ vụn như phi vào đất cát ấy, bịp thật",negative
836,"phim xem ổn về mặt giải trí nhưng mà chê ở phần kết, ít ra cũng phải giao lưu võ thuật tí rồi thua thì thua chứ boss chính cả phim xuất hiện dc vài giây đã cook r :)))",negative
837,Có một câu hỏi troll hay được hỏi về Aquaman là ổng và người Atlantic đi ị chổ nào😂,neutral
838,"Túm lại phim rất đáng xem nha mn. Suy cho cùng thể loại nào thì mình nên mong đợi cái đặc sắc của thể loại đó, siêu anh hùng kg nhất thiết phải nặng đô, chỉ cần hình ảnh bắt mắt, nội dung nhẹ nhàng đi sâu vào lòng khán giả là toẹt vời",positive
839,Cá nhân mình thì thích DC dark hơn. Thêm đùa giỡn vào nó mất chất làm sao ấy.,negative
840,"công nhận đoạn cuối hụt hẫng thật, tưởng vua của vương quốc bị bỏ quên thế  nào cơ =)) có ai thấy vương quốc bị bỏ quên giống quê nhà anh Thỏ của Marvel k?",negative
841,"Năng lực của James Wan thì không cần phải bàn cãi nhiều, phim của ổng ra rạp đa số sẽ lãi to. Tiếc là phim này vướn phải nhiều rắc rối bên lề. Sinh ra không đúng thời điểm.Thật sự thì vẫn muốn James Wan quay lại với phim kinh dị, không thì hãy cho ổng làm phim SAH nhãn R thì có cái để mong đợi",positive
842,Nói chung vẫn như phần 1 . Đinh ba thần mô tả rất quyền năng nhưng vẫn chỉ dùng để giáp lá cà và gọi cá. Đinh ba đen cũng chả khá hơn. Cả phim chỉ có nhiệm vụ truyền tải kí ức. Múa đc vài đường xong nát bét.,neutral
843,Hành động vs kinh dị phong cách james wan luôn có nét động lạ riêng biệt so với những người khác. Phim james wan có thể ko đáp ứng khía cạnh cốt truyện nhưng phần giải trí chắc chắn ko thất vọng,positive
844,Phim thiếu cảnh giao tiếp giữa 2 vc Aquaman. thậm chí không có cảnh tấu hài nào giữa 2 nhân vật này lun,negative
845,"Mọi thứ đều khá ổn 
Cho đến khi boss cuối bị ăn đúng 1 hit :)))",neutral
