,Comment,Label
275,"Điều khán giả và tất cả những người hâm mộ joker muốn thấy chính là một kẻ bứt ra khỏi khuôn khổ, một kẻ dám vùng lên khi bị xã hội thối nát giày xéo điều mà họ luôn mong muốn nhưng không thể làm cũng như không dám làm. Còn người như Joker trong phim đầy rẫy ngoài kia một kẻ tâm thần , tâm lý bất ổn, bị lợi dụng bắt nạt, vẫn chịu đựng sự dày xéo. Vậy Joker còn gì đáng xem, họ ở đó để xem một người giống như họ ư ? Rõ ràng đây cũng chỉ là một kẻ đáng thương bị tuyên án",neutral
276,Joker quậy phá thành phố đâu ? Gặp người dơi đâu ? Sao cho chết mất rồi ?,neutral
277,Lói chung là yêu vào là chỉ biết đến nhau thôi chứ Joker ko quan tâm nhiều đến anh iem xã hội nữa... :)))),neutral
278,"Phim hay, mới đi xem hôm qua 😊",positive
279,Nhưng cái tôi cần là nội dung phải có liên quan đến các phần trước,neutral
280,Thấy Prometheus rất hay đó chứ nhể mà có vẻ bị ghẻ lạnh :v,neutral
281,"ê phim hay nha, có 1 nhân vật có thai xong cũng bị gieo mồng của con quái vật, khúc đẻ ra nó lai người vs quái vật trông sợ vl hic, đáng để xem nha❤",positive
282,Phim hay❤,positive
283,"Mình mới xem phim lần đầu, hay hơn kì vọng ❤❤❤",positive
284,"Thề phim này góc quay, ánh sáng, âm nhạc với âm thanh đỉnh thật sự. Cảm giác nỗi sợ bị ông đạo diễn thao túng toàn bộ",positive
285,"Phí ngay 2 lít đi coi. 


Phần này còn kèm hơn cả Prometheus, ít ra Prometheus còn cho ra 1 dẫn dắt hợp lý.😅",negative
286,"Phim ok nhưng buff nữ chính quá.....1 người mới gặp Alien lần đầu mà lại không có cảm giác sợ run ra cơ à ? Cũng không có sự lúng túng nữa kìa.....các tình tiết dc sắp đặt quá k tạo nên sự khó khăn khi đối mặt với 1 con Xenomorph.....Phim cũng nerf quá mạnh về sức mạnh và thông minh của 1 con Xenomorph nên bị trừ khá nhìu điểm, dù tôi có kì vọng quá nhìu về 1 con Xenomorph .....Còn lại thì phim làm rất tốt về bối cảnh + âm thanh và phân cảnh khởi động lại con tàu và máy móc khiến tôi nhớ đến những phim của thập niên 90 ....Quá tuyệt k còn gì để nói",neutral
287,Đúng là hay hơn kì vọng của mình,positive
288,"Ko nên xem suất muộn vì buồn ngủ lắm :)) cả phim tối thui, cốt truyện nhạt",negative
289,Điện ảnh 2024: Năm của ăn mày quá khứ!,negative
290,"Theo cảm nhận của mình là fan của serri Ailien thì phim tệ, Nhân vật nữ chính mờ nhạt, không rõ chất nữ anh hùng như serri cũ, thứ 2 phim hù bằng những đoạn âm thanh bất chợt rẻ tiền, ailen bị giảm sức mạnh quá đáng không có sức mạnh vượt trội như hình ảnh từng xây dựng (khiến con người có cảm giác tuyệt vọng), phim cặn chiều sâu, cuối phim con ailen lai giữa bào thai con người và hợp chất Z01 xấu xí ghê tởm chứ không mạnh khủng khiếp. Thứ 3 sau khi xem phim xong không để lại dấu ấn mong chờ và cái kết mở như những phần phim trước. Tóm lại theo mình phim chỉ đáng 5~6 điểm",negative
291,Có nên đốt thời gian đi coi phim này không mn? Tại hiện giờ ngoài rạp không biết coi gì? Mình không hẳn là fan của seri này nhưng có coi hết tất cả phần rồi.,neutral
292,"Mình mới chơi game Alien vào mấy tháng trước thôi, mê cái cảm giác hồi hộp, ngộp thở, kinh hoàng với những cú rượt đuổi và trốn tránh với bọn Alien; thích sự thông minh nguy hiểm của mấy con đó, chơi siêu siêu thích, nên đi xem phim lần này mang lại cảm giác tương đối giống với những gì mình đã từng chơi... Hay nha ( phần này thích cậu bé người em robot, cần một nv quyết liệt như thế)",positive
293,"phần này góc quay không quá rộng, coi cảm giác hồi hộp như 3 phần film đời đầu",positive
294,"Âm thanh hay. Kinh dị tốt. Nhưng cốt truyện thì không quá nổi bật.
Với mình, Prothemeus mới là phần phim đẳng cấp nhất",neutral
295,Tôi vừa đi xem romulus về. Đỉnh của đỉnh luôn. Các bạn nên ra rạp để trải nghiệm!,positive
296,"mọi thứ đều ổn nhưng nhiều hành động của nữ chính thì gây khó hiểu vl, liệu ngoài đời ng ta có ứng xử vậy không nhỉ??? Robot thì yếu xìu, quánh cái sùi bọt mép quài luôn á... với khúc axit bay xung quanh nữ chính là khúc ảo lòi nhất phim, với lương axit dày đặc như vậy mà có thể lướt qua dễ vậy thì rất là phi lý ý. Nhưng cả phim tổng thể thì khá ổn.",neutral
297,cảnh xả súng của nhân vật nữ bắn nát đầu bọn alien mới chính là cảnh hay nhất chất nhất của phim alien tiếc là cảnh bắn nhau quá ít alien là phải bắn mấy con alien cho đã nhứ phần 2 mới hay chứ cảnh bị đuổi nhiều quá cũng hơn ngắn mong phần xong có almf thì làm cảnh bắn mấy con đó nhiều hơn là được ko cần màu mè làm j làm mất chất phim.,positive
298,"Hơi bất ngờ là face hugger giờ năng động quá. 😂😂😂. Bất ngờ nữa là phần bối cảnh của phim quá đẹp theo kiểu dystopian quá xuất sắc. Phần này theo lại mô típ cũ, tuy là dễ đoán nhưng trải nghiệm xuyên suốt bộ phim rất tốt. Cốt truyện đơn giản, để làm nổi lên sự hồi hộp kinh dị như phần đầu. Tiếc là không có thêm thông tin gì mới về cốt truyện. Nói chung phần này rất hay mặc dù còn khuyết điểm nhưng có thể là một trải nghiệm thú vị. Coi như đây là bản remastered ko hoàn hảo của phần phim 1979 cũng đc🎉🎉🎉",positive
299,"Nếu nói về hiệu ứng hình ảnh âm thanh thì phim này xuất sắc 10/10 , nội dung phim 7/10 , nói chung coi rất đáng tiền nha các bạn , phim Hay cực",positive
300,"🎉phim hay thật mọi người ơi vừa mới đi coi về lun 🥲🥲 main nữ tưởng ko ngầu nhma ngầu vãi chưởng. Bị cái ko thích cách cho mấy thành viên khác đăng xuất hơi nhanh, kiểu họ chưa có vai trò gì nhiều nên thấy hơi chóng vánh",neutral
301,"Phim hay nha mọi người, rất đáng xem. Hiệu ứng hình ảnh đã mắt, trông rất thật.Mình xem ở định dạng thường thôi cũng cảm thấy đỉnh rồi, chưa có cơ hội trải nghiệm 4DX, hay IMAX, những đoạn ngoài không gian thực sự làm nổi da gà, diễn xuất diễn viên lột tả được sự đáng sợ của con quái vật, tuy vậy nhưng có vài điểm lấm cấn khiến nó thực sự bình thường, Thích các cảnh dùng ánh sáng hợp lí khiến con quái vật mờ mờ, ảo ảo trông rất đáng sợ,  Đặc biệt đoạn cuối khiến tôi ngồi không yên, rất ám ảnh",positive
303,"Diễn viên tệ, cốt truyện như parody giữa các phần trước, hiệu ứng 7 điểm, nội dung 2 điểm, diễn 2 điểm, kinh dị xét về giật gân 6 điểm, xoá bỏ các màn tra tấn thể xác thay bằng tra tấn không gian và âm thanh. Không thấy máu me, chết nhảm khá nhiều ( như thằng đầu chết vì axit). Nói chung bỏ 100k ra coi vì giải trí, còn xét so với 2 phần đầu thì k khác gì đống rác",negative
304,"Alien 4 đã đủ gứm ói rồi, phần này ám ảnh luôn 🫠 rợn da gà, quả body lai đúng gứmmmm. Ai là fan Alien nên đi xem sẽ không thất vọng đâu ạ 🎉",positive
305,"T đi xem k kì vọng quá vào nối tiếp các phần trước thì thấy hay. Nội dung dễ đoán, nhà làm phim muốn khai thác về tc gia đình con ng- AI trong tương lai, phù hợp hiện tại khi các AI phát triển nhưng cảm giác khai thác chưa đủ tới. Bù lại âm thanh, hình ảnh quái vật, hình ảnh liên quan vũ trụ thì tuyệt. Suốt phim đan xen cảm giác giật gân nên không chán. Cảnh cuối mình nghĩ alien mới sinh ra sẽ giống phần cũ nhưng lại khác và hành động là giết ""mẹ"" cũng khác thì mới nhớ ADN từ ""mẹ"" đã không giống nhau😂. Với mk rất đáng xem,  so với tầm chung các phim khác từ năm ngoái là trên kì vọng về thể loại giật gân . Cảm giác k tiếc thời gian và vé😊",positive
306,Co ai nhìn con trùm cuối nổi da gà như mình ko ? sợ thặc. kiểu tởm tởm sao ấy,positive
307,"phim hay, đã coi 2 lần",positive
308,"khi trọng lực có trở lại, nữ chính rơi xuống thì con Xeno bắt lại. Rồi thang máy rơi xuống, nó còn bít núp vô trong để tránh nữa chứ.",neutral
309,Con trùm cuối nhìn kỳ quái ! Nhưng phim rất hay,positive
310,"Mình với vợ vừa đi xem,hay tuyệt luôn á",positive
311,"mình đã xem hết tất cả các phần đã ra rồi nên theo đánh giá thì romulus khá dễ đoán với cái kết , hình ảnh âm thanh độc đáo và ý tưởng về nội dunh khá tuyệt chỉ tiếc là cái kết hơi dễ đoán 😊😊😊",neutral
312,"Hôm đi xem mình cũng ko mang quá nhiều kỳ vọng, nhưng nó hay hơn mình tưởng ấy 😆😆",positive
313,"vừa đi xem xong, hay ngoài mong đợi, đỉnh thật.",positive
314,"Mình vẫn thấy Prometheus hay mà, Covenant thì chán thật sự, Romulus thì hay hơn kì vọng",positive
315,Đã xem nhìn chung về mặt hình ảnh phim đẹp chất lượng. Nội dung thì dễ đoán nhưng cá nhân mình thấy là nên có nhiều pha giật gân ko phải jumpscare mà là kiểu rình rập thì sẽ làm phim nó sợ hơn.,neutral
316,Bản chiếu ngoài rạp có bị cắt nhiều cảnh đúng không? Hôm qua đi xem thấy thất vọng. Không hay,negative
317,Mình thấy bình thường,neutral
318,thay vì coi tuyệt phẩm mada thì coi cái này thấy mình yêu thương tiền mình làm ra hơn,positive
319,"Hôm đi coi trong rạp có đúng 5 người phim chiếu được một nửa thì cặp kia bỏ về hình như sợ quá hay sao đó🙂 mà phim hay thật nha thích cái cảm giác hồi hộp rợn rợn người trong rạp phim tối om ghê, đúng kích thích… Thật sự không kỳ vọng nhiều ở phim nhưng cảm giác sau khi xem xong thấy đã vô cùng, lâu rồi mới có phim cho mình lại cảm giác kích thích vậy.",positive
320,"Xem chán, thực sự chán. Bạn mình xem cùng không biết nhiều về Alien cũng bảo phim chán.",negative
321,"Phim này left ailen nhiều quá , kiểu giảm chí thông minh của tụi nó ấy , 1 mình nữ chính trẻ ko kinh nghiệm chiến đấu với 1 khẩu súng trong tay tiêu diệt hơn chục con ailen , thử hỏi 1 đơn vị khoảng lính người nhân tạo cập nhật phần mềm chiến đấu với khẩu súng đấy thì nó làm cỏ hết, chẳng hiểu sao con ailen đầu tiên lại giết đc cả trạm ??? Phim xem cũng đc nhưng kiểu không logic ấy",negative
322,Phần này là thấy creepy nhất trong tất cả các phần. Nhưng lại là phần tròn trịa nhất. Ít nhân vật nhưng chất lượng cao.,positive
323,"Hôm 28 đi xem phim, 5h chiều 1 mình 1 rạp🙃 nhưng ko thấy sợ, phim này vs mình 6/10. Muốn vắt sữa Alien kiếm tiền tiếp thì mấy phần sau hãng nên làm về cái tập đoàn đầu xỏ Yutani rõ hơn đi. Suốt 45 năm qua chúng ta đã quá hiểu rõ thuộc làu làu về đặc tính của nó, sức mạnh, tính cách, sinh nở úp mặt vật chủ ẩn dụ hiếp dâm gì gì đó,… có lẽ bí kịch bản và muốn nó đáng sợ, cú twist hơn thì cho ra 1 con ""Newborn"" lai đủ thứ cuối phim. Với mình, nhân vật chính, ngôi sao là Alien Xenomorph, ko cần những con khác, những hợp chất đột biến gì đấy, trông nhiều thêm rối, thấy lạ xong quên ko đọng lại như Xenomorph gieo rắc nỗi ám ảnh trên màn bạc 45 năm trời",negative
324,"Mấy bố mẹ nào khen phim này chắc phải nhạt lắm rồi, chứ cột truyện thì tệ, tình tiết dễ đoán, lạm dụng yếu tố jumpscare quá mức, diễn viên quá lố, được mỗi a da đen là có được yếu tố diễn xuất. Các bộ 1979, 1986, 1992, 1977, 2012, 2017 ra trước cả chục năm mà vẫn thừa sức để ỉa lên bộ này nhé. Bộ này là nỗi ô nhục của dòng phim Alien. Đúng như deadpool đã nói ""Vắt kiệt đến 90 "". Mấy bố Phê Phim chắc sợ bị công kích mất miếng ăn nên éo dám nói thẳng đây mà 🤣🤣, kiểu đéo gì cũng nhột  lại chả xóa comment này.",negative
325,romulus thật tệ . Nội dung quá cũ và đơn giản . Đại loại vì lý do nào đó mấy thanh nhiên hiếu kì đi vào nơi nguy hiểm . sau đó là liên tiếp hành động ngu và chết . lối mòn,negative
326,"#Alien: Romulus
Bình thường nhưng không tầm thường 
Case tương tự Dune 2: siêu phẩm nhưng lại bị chèn ép suất chiếu một cách rất khó hiểu và md 😒
Bắp còn nguyên, hết phim phải ngồi 30’ đợi hồn về 
Xem review nhanh mấy phần trc rồi vào xem cũng đc
Theo dõi sự tiến hoá của quái vật phê lắm mn ạ
Đoạn đầu phim đã xử lí qua rất nhanh, ko bị dài dòng
Từ giữa đến cuối dồn dập hồi hộp quá tr đã luôn á 
Rất rất rất đáng tiền 10/10",positive
327,"tôi đã xem rồi, nên ra rạp phim 4dx xem mới chất lượng, gây cấn tới đoạn cuối cùng, và rất nhiều cảnh làm người xem sợ giật mình",positive
328,"Nghe đến đoạn nghiên cứu kỉ đặc tính của giống loài xenomorph là thấy buồn cười rồi, xeno có nghĩa là ""khác lạ"", morph có nghĩa là "" hình dạng sống"" dịch nôm na là dạng sống khác (khác hình dạng con người) hoặc dạng sống kì lạ, vì vậy xenmorph thật chất chỉ là thuật ngữ chung chỉ những dạng sống chưa xác định trong vũ trụ chứ nó không phải là một loài. Còn nói đến đặc tính, không thể so sánh đặc tính hay bản năng trong alien prometheus, bởi vì trong phim đó không có cảnh alien trưởng thành hành động, nên không biết đặc tính và bản năng của nó. Alien có nhiều biến thể, mỗi biến thể có khả năng và nhiệm vụ riêng, nên đặc tính cũng khác nhau, không thể túm cái váy cả đàn như vậy được, trong alien convenant là một dạng alien mới, đến con facehuger cũng mới cho nên đặc tính nó cũng khác, vấn đề của Prometheus và Convenant nằm ở kịch bản chứ không phải ở mấy con alien. Sau khi Prometheus ra mắt mà không có con alien nào trong đó, Fox đã lo lắng cho Convenant sẽ thất bại bởi vì sau Convenant sẽ còn một tập alien nữa, nên họ đã nhúng tay chân của họ sâu đến cỗ, Ridley Scott khi đó lo lắng Fox sẽ hũy dự án của ông và Convenant sẽ không bao giờ ra rạp, ông đã để Fox thay đổi kịch bản. Và đó là tất cả những gì đã xãy ra ở Alien 3 và 4 khi 2 phần phim này có cái mũi chà bá của Fox nằm trong đó, giờ thì Fox lại lần nữa thò mũi ngữi đống phân của họ sao đó là hũy phần tiếp theo của Convenant. Ridley Scott đã làm hết sức mình với Prometheus và Convenant cùng với cái mũi của Fox bỏ vào để xào bộ phim theo ý của họ và hũy hoại tầm nhìn của đạo diễn.",neutral
329,"Cảm giác nó không đủ ghê, mấy phần trc nhiều người máu me nhiều hơn, phần này có 5  ko được bao nhiêu, bất ngờ nhất cái con quái cuối mà thôi",neutral
330,Nữ chính xinh thật😂😂😂,positive
331,"thích nhất prometheus rồi tới alien 2. Romulus này thực sự mình thấy quá dễ đoán, biết trước mọi thứ rồi, cũng chả có plot twist gì hay mở rộng gì lắm nên thấy rất bình thường",neutral
332,ko hay lắm. nữa tiếng đầu phim đã dài lê thê mà ko vào thẳng vấn đề nên phí thời gian nữa tiếng đàu phim. gây nhàm chán. phim hay nhất phải là prometheus 2012,negative
333,"T thấy nó khá hay 
Từ bối cảnh đến tương tác nhân vật đều rất hợp gu 9.5/10 
Trừ 0.5 vì 1 số nhân vật ngu quá 🫠🫠",positive
334,"Pha comeback đầy hứa hẹn của alien, đúng là hay hơn kì vọng của mình",positive
335,Không biết khi nào mới có phần alien vs predator nữa,positive
336,"Mé tao fan ruột franchise mà thấy phần này nó sao sao á, nhất là vai robot vs cái mạch film",negative
337,Quá đồng ý với câu cuối - dù holyhood có sản sinh bao nhiêu quái vật đi nữa vẫn phải đứng sau cái bóng của alien ❤,positive
338,"Sao mà con quái nó lớn nhanh kinh khủng vậy? Hơi thiếu logic. Mới đẻ ra bằng cái tay, chút xíu sau đã to giã man rồi. Con boss cuối vừa đẻ xong mấy phút sau cao 3m. @@ Mấy phim ngày xưa cảm giác con quái nó không bị lớn nhanh quá phi logic như bây giờ!",negative
339,"cho mấy bạn chưa xem mấy phần trước thì phim này lấy bối cảnh ở giữa phần 1 và phần 2, trước khi Ellen Ripley quay lại tìm đứa bé",neutral
340,Muốn xem tiếp nối phần trước cơ. Phần này thấy ko hay bằng phần trc.,negative
341,không biết có ai giống tui không tui mê con alian đó quá nhìn nó hấp dẫn như nào í,negative
342,Phim khá nhạt so với các bản tiền nhiệm thời xưa.. chắc do mình fan cứng nên mong đợi nhiều hơn như thế,negative
343,"Thề, những pha jumpscare trong phim đều khiến mình giật mình, thứ mà đó giờ ít phim nào làm được vì mình đã quá lờn với phim kinh dị. Phim sáng tạo và hay vãi, tuy nữa đầu phim vẫn chưa được thấy Alien nhưng nó là cần thiết để giới thiệu dàn nhân vật và bối cảnh của phim.",positive
344,"Tooi thấy phim hay chỉ có cái là nữ chính diễn mà mặt đơ quá, xem hơi khó chịu vì không đã",negative
345,"Thích phần Prometheus hơn, vì nó giải thích nguồn gốc Aliens và có nhiều cảnh rộng hoành tráng",positive
346,"Từ lúc facehugger cấy ký sinh thì tầm mấy giờ mới lớn lên rồi nở ra con chest, mà trong phim chưa đầy 10-15p đã nở rồi, quá nhanh so với phần cũ.",neutral
347,"Kết phần này, chuẩn phong cách phim Alien 1978 và thực chất nó là phần nội dung nằm giữa Alien 1978 và Aliens 1986.
Căng thẳng, ngột ngạt, từ tạo hình nhân vật đến máy tính, đồ du hành vũ trụ … bám sát phong cách dòng phim này chứ ko hi-end như các phần Prometheus và Convenant.
Prometheus và Convenant mang tiếng là tiền truyện nhưng công nghệ xịn hơn cả những sự kiện xảy ra sau đó hàng trăm năm???",positive
348,"phim này xem giải trí tốt, âm thanh hình ảnh hay, nữ chính đẹp, còn nội dung thì 6/10 thôi, tổng thể chấm 7/10",positive
349,"Người máy Andy từ đầu hễ cứ ăn tát là nằm giật giật, cứ tưởng sau upgrade thấy tăng cường phản xạ các kiểu sẽ bá như người máy phần Covenant hóa ra vẫn cứ ăn tát nằm giật giật, chán hẳn 😅",negative
350,Má phim hay hơn mình tưởng thật coi xong mới thấy nó hay vl,positive
351,"thề là người máy Andy lại thể hiện biến đổi tâm lý rõ nét nhất, diễn viên thủ vai đỉnh thật sự. chỉ cần nhìn vào đôi mắt là thấy rõ sự khác biệt sau khi đổi modun",positive
352,Vẫn thích cái tò mò về nguồn gốc như phần convenion với prometheus hơn. Xem kiểu nhân vật bị rối xem cáu vl.,negative
353,"cũng bình thường mà, chắc xem nhiều quá nên thấy phần này bình thường ko kinh gì cả",neutral
354,"Xem mà tức cái đoạn cứu con bé kia, không cứu thì 3 ng sống rồi . Cứu nóa xong ngỏm hết lại còn gặp thêm quả Alien lai người nữa. Tức điên ",negative
355,cái vấn đề sinh học của mấy người làm phim có quái đảng thật đấy chứ,neutral
356,Tôi vẫn thích Prometheus,positive
357,Phim hay. Diễn xuất tốt nhất lại là của 1 người máy. Cảnh ấn tượng nhất là khi đứa bé đc sinh ra. Mình tưởng sẽ có cảnh âu yếm của con dành cho mẹ chứ,positive
358,Cũng thường thôi ko đáng kì vọng lắm,neutral
359,"không phim nào hoàn hảo, nhưng tôi chấp nhận ra rạp lần thứ 2 để xem deadpool nhảy trên nền nhạc Bye Bye Bye",neutral
360,"Một kỷ niệm khó quên và quê vl vì khi đi xem phim có mình tui hiểu các joke trong đó và chỉ mình tui cười và hú hét, thậm chí có cặp còn quay qua tui hỏi người sói là ai tại thấy poster phim đẹp nên vô xem =))",positive
361,Phần đầu rã cốt đã thực sự,positive
362,"phản diện như bòi , xem vì easter egg cũng đc , với cả xem hài chứ nội dung thì như cái mớ dẻ lau nhà , y như hàng tank của Ngọc 6 múi",negative
363,"mình vừa đi xem về xong, ko spoil nhưng mà cảm thán là chán ạ, ko thấy hay như 2 phần đầu. :))",negative
364,Ladypool nhìn nuột vcl,positive
365,"(spoil) tôi cứ tưởng phân cảnh deadpool văng tục rồi lấy xẻng đập liên tục là để gọi logan dậy cho đến khi thấy bộ hài cốt đã vật thánh lầy còn gọi wolverine bằng tên thật là hugh, nể luôn=))",neutral
366,"Chuyến này chú Robert với chú Hugh xong phim với Marvel rồi, vắt đến khi sức cùng lực kiệt mới thôi luôn. Các bạn nên chuẩn bị tinh thần đi vì các màn Camel trong phim phải gọi là bùm bùm bùm cảm giác như muốn nhảy khỏi ghế hét lên vậy. Tiếc là nguyên cả rạp 50 - 60 người mà có mình mình kiên nhẫn ngồi chờ After Credit thôi nên cũng hơi nản ...",positive
367,"Với 1 đứa tuy không hẳn là fan nhưng đã xem qua hầu hết những bộ trước đó của M thì t thấy khá hài lòng và thoả mãn với fan service của bộ này, đặc biệt ấn tượng với quả intro, nghe phát nghiện luôn.
Còn nếu xét về tư cách 1 khán giả đơn thuần thì nói thật nội dung và cốt truyện hơi rối, thời lượng thì dài mà kết chưng hửng. t xem xong còn bị sượng trân nhiều đoạn thì non-fan tò mò đi coi vô ngồi chắc ngơ ngác cmnl 😂
Nói chung ai đang cần xem phim giải trí, thích xem đúm nhau banh nóc thì quá OK, vô ngồi nghe thằng Pool khịa với chửi bậy cũng vui tai phết 😂 nd thì 5/10 thôi",positive
368,"Nói thẳng chả khác gì nồi lẩu thập cẩm, trong đó chả có gì nổi bật, chả muốn gắp gì, phim quá tệ
Kết là chả khác gì hải nhảm",negative
369,"bộ phim này rất tệ, cảnh hành động đa phần là đi farm bot thôi, đc mỗi cái giữa phim đánh nhau chí choé đc xíu tầm 10p. Các cảnh hài hước rất nhạt vì đa phần là tiếng lóng chơi chứ tiếng anh + Sub ko sát nội dung nên chả có hài hước gì trừ mấy cảnh mà nó nói thẳng ra luôn. Nôi dung đối thọia cũng dỡ, có mỗi vấn đề deadpool nó giấu ma tuý trong nhà  mà nó với bà mù cãi nhau cả buổi.  Tóm lại phim tệ, ko có logic gì hết, đánh nhau quá tệ hài hước thì ko đến nơi đến chốn",negative
370,Vừa vô mấy phút đầu nhìn DP vừa đồ sát vừa nhảy trên nền nhạc Bye Bye Bye là tôi biết tối hôm nay đéo phí tiền rồi. :VVV,positive
371,Cái kết quá đắng cho a Cap .. à quên anh  Jonh,negative
372,"Phim lan man nhiều nhân vật gây nhiễu, quá nhiều sự kiện hỗn loạn không đọng lại được cái gì",negative
373,đừng đi xem với bố mẹ :)))) phim nhãn R mà còn ai đi coi vs bố mẹ nữa :))),neutral
374,Nội dung xem như đặc cầu đc cái hài bẩn với hành động,negative
375,"Deadpool    ôm   Captain    nhưng   lại   là   4   của   bộ   tứ   siêu   đẳng,   1   cái   miệng   cũng    ko   thua  kém   gì   deadpool.  Tếu    thật.",positive
376,phim xem phải nói là đéo hiểu gì trừ hài nhảm. Vắt kiệt sữa,negative
377,Nah cảnh đắt giá nhất ở cuối phim. Đống cơ bắp đó là quá đủ cho 1 bộ phim hoàn hảo :))),positive
