,Comment,Label
1,"P1 kiệt tác mọi thời đại rồi nên cũng đừng kì vọng p2 cũng phải ngang tầm, chỉ cần chất lượng ổn áp là đủ rồi",neutral
2,"p2 gần như là 1 phần bôi nhọ p1 , ai lại có thể nghĩ ra main p2 là con của bà công chúa p1 ngoại tình với maximus chứ, phản diện bị giai quyết 1 cách vớ vẩn lãng xẹt ko rõ động cơ nữa. Tóm lại so với p1 thì là 5/10 đó là chấm xông xênh lắm rồi đó",negative
3,"năm nay kiểu gì toàn bom tấn thành bom xịt , phim đầu tư nhiều tiền mà khổ nỗi kinh bản với nội dung xem bán thôi dồi .phim giờ chất lượng đi xuống quá nhiều",negative
4,"Đúng là cảm xúc ở các đoạn cao trào vẫn làm chưa tới, vẫn thiếu thiếu",neutral
5,"Phim khúc cuối nó dở 1 cái, như phim Việt Nam",negative
6,"Nếu ko biến Lucius/Hanno thành con trai của Maximus và Lucilla thì phim vẫn sẽ ổn, thậm chí hay hơn. Thay vì là cha ruột, Maximus có thể trở thành father figure hoặc niềm hy vọng cho Lucius khi bị mất đi tất cả và biến thành đấu sĩ.",neutral
7,"P2 chắc 6/10 so với phần 1
Tui đi xem mà chả có tý cảm xúc nào cả 
Biết thế đi xem phim khác hay hơn",negative
8,sao coi phần 1 ko thấy chi tiết nào nói lucius là con trai của maximus z??,neutral
9,phí tiền,negative
10,Phần 2 nhân vật chính có giáp cốt truyện,positive
11,"Phim tốt cho đến đoạn bắt phản động, sau đấy nó tệ và ngu ngơ 1 cách khó hiểu :)), xong cho Lucius thành còn Maximus khó hiểu vkl (phần 1 ai chả biết Maximus yêu vợ con như nào, chả nhẽ ngoại tình?), rồi liên tục spam Maximus trong khi phần đầu cái hành động bốc cát của Lucius là hoàn hảo rồi -> phim này chắc 5/10, hay nhất chắc phần dàn dựng và hình ảnh và diễn xuất của Denzel, ông dv chính diễn ổn mà khẩu hình tệ vc (giọng đặc British)",neutral
12,"Đúng là cho chi tiết Lucius là con trai Maximus hơi dở, vì phần 1 chỉ có 1 xíu hint 2 ng này yêu nhau thôi chứ k có hint con cái gì😢 để Lucius coi Maximus là ng truyền cảm hứng thôi là phim quá hay rồi.
Còn nếu mà là con của maximus thì chắc kiểu ông ý vs bà ý yêu nhau từ trc mà k đến dc vs nhau, có thể vì bà ý phải đi lấy chồng hôn nhân sắp đặt, 2 ng chia tay, bả có bầu k cho ổng biết 🤣",negative
13,Phần 2 không có Hans Zimmer làm nhạc cảm giác phim mất đi một nửa tính sử thi hùng tráng rồi. Nói chung xem cũng hay đánh giá 7/10 so với phần 1. Gì chứ phim sử thi chiến tranh của cụ Ridley nó vẫn ở tầm đỉnh cao của thế giới rồi nên mấy bạn chê cũng tém tém lại đi,positive
14,"Mọi người  có thấy cách bộ phim giải quyêt khúc cao trào cuối phim thật sự qua loa và thiếu chiều sâu 0.  khi mà 1 kẻ lọc lõi và quỷ quyệt như tay chủ nô do Diêzel thủ vai lại chọn cách liều lĩnh giáp lá cà với 1 thanh niên trẻ khoẻ đang độ tuổi sung mãn 1 cách liều lĩnh và rât 0 cần thiêt như vậy. trong khi trong tay hắn ta đã nắm giữ quyền lực của quân đội qua biêt bao âm mưu và công sức. 1 số đoạn hanno thuyêt trình với cac đồng đội về danh dự hay niềm tin cũng hơi gượng ép l, kể cả tình tiêt công nhận hanno là con ruột của maximus nữa.1 số sạn khá là lộ liễu như khâu an ninh phòng giam hoặc kiểm soat nô lệ trong của phí quân đội la mã và cận vệ trong đấu trường ( cảm giác quá lỏng lẻo)  chắc phim chỉ xứng 7 /10 thôi.. âm thanh hình ảnh tuyệt vời nhưng kịch bản hơii yếu. 0 được kịch tính, bùng nổ và thoả mãn như kỳ vọng sau hơn 20 năm chờ đợi. Thật sự hơi tiếc vì đáng ra phim có thể làm được nhiều hơn   😢. T",neutral
15,"Vô rạp coi mà cứ muốn skip qua mấy phân đoạn nói chuyện để xem đánh nhau, phải nói là cốt truyện nhạt nhẽo.",negative
16,muon hay thi phim phai 4 tieng tro len vi nhip phim qua nhanh,neutral
17,"Ridley scott trịch thượng ở chỗ luôn tự cho mình là đúng về mặt lịch sử. Lịch sử của 1 dân tộc, 1 đất nước khác mà ông ta chế cháo tiểu tiết thì không nói làm gì, hư cấu cái gì thì hư cấu...nhưng phần 2 này ""dám"" cho diễn viên denzel washington thủ vai quan chức la mã là bậy lắm rồi",negative
18,"Thật sự mình cảm thấy p2 mạch phim rất ép đặt chứ ko hề tự nhiên như p1. Từ đoạn Lucios bị ép vào đấu trường xong thêm quả Lucios là con của Maximus, liệu đạo diễn nghĩ rằng làm thế để Lucios thừa hưởng ý chí chiến đấu, khả năng lãnh đạo như người cha mình?",neutral
19,cảm giác đi coi phim này đều tầm 35 trở lên vì cái âm hưởng của phần 1,neutral
20,thế là thằn nhóc prince nắm tay maximus p1 cũng là con của ổng luôn à :)).. tướng này giỏi đấy múc dc cả con gái của vua :)),neutral
21,"Cá nhân mình thấy nội dung film có quá nhiều lỗ hổng, kịch bản rập khuôn phần 1, không đáng để ca tụng khen hết lời ( nghe như marketing). Mình xem phim khá khó tính nên phim không logic thì có nhiều điểm cộng đi nữa cũng không bù nổi. Cảm giác làm thêm 1 phần phim để vắt sữa dựa hơi phần 1, nếu không có phần 2 thì tựa Gladiator đã là 1 tựa phim bất hủ với mình. 
Về kỹ xảo, cảnh quay hay diễn xuất thì theo mình cái đó bắt buộc phải tốt với những phim tầm cỡ này.",negative
22,"lúc xem cũng k kỳ vọng nhiều lắm vì thấy Imdb đc có 7đ, mà xem thấy vẫn thất vọng, chỉ xứng làm cái bóng cho phần 1.",negative
23,Lúc xem phim thấy lucilia nói lucius là con Maximus là đã thấy thất vọng rồi…phần 01 kết rất đẹp…trả thù xong là lên thiên đàng với gia đình…trọn vẹn,negative
24,P2 coi chơi thì được chứ so sánh với  p1 thì khó lắm,neutral
25,Tự nhiên khúc cuối hai bên dàn quân xong đi về. Ít nhất cũng phải bem nhau cái rồi ông nội kia muốn đứng lên nói gì nói rồi hold lại không đánh nữa. Khúc cuối y như kiểu đi thì văn đang phân tích thấy sắp hết giờ cái kết bài vậy,negative
26,"cứ cho là con của Maximus thật đi thì cũng là con ngoài giá thú, hoàng tộc theo máu mẹ, k có lý do gì để mà tướng lĩnh cận vệ và quân viễn chinh Acasius thần phục luôn. 

Quả thù hận cũng chán, giết vợ nhưng là trên chiến trường, quả cố chấp khiến nó tù k đáng làm kẻ tranh ngôi, mà đã cố chấp thì cố chấp hẳn đi, sau lại quay ngoắt nhanh vc. Đang là người Nemia mà chớp phát đã thành con dân Rome :)))) Đoạn đấu sĩ nghe theo để phản động cũng hài, đấu sĩ là nô lệ, kêu gọi vì tự do với chiến đấu cho tranh ngôi của Hoàng tử Rome xong tất cả nghe theo là hài hước vô cùng. Mấy bài diễn văn cũng thật nhạt.

Thật sự là nhiều đoạn chán chả muốn liệt kê, quá thấy vọng cho hậu phần của 1 siêu phẩm.",negative
27,Điểm cộng duy nhất chắc là bác Pedro đẹp và diễn hợp,negative
28,"Hơn 20 năm trước mình cùng ba ngồi coi phần 1 trên TV, khi đó mới tí tuổi đầu chưa hiểu gì về danh dự võ sĩ mà vẫn ấn tượng và ghi nhớ mãi về người anh hùng Maximus. Người chống mất vợ, người cha mất con, người tướng mất chủ nhưng vẫn hiên ngang ngẩng cao đầu.
Tuần rồi quyết đưa cha xem tiếp phần 2 để ôn lại kỷ niệm xưa thì quả thật bức xúc tới nỗi muốn nắm tay ba bỏ về giữa buổi.
Ở phần 1 mình ấn tượng nhất là phân đoạn Maximus quyết tâm cứu Lucius vì nghĩ tới con trai đã mất của mình, đồng cảm với hoàn cảnh của cậu bé, vì biết cậu cũng ko còn cha. Sự thương cảm đó là tình cảm giữa con người với con người, thứ mà Commodus đã đánh mất trên con đường chiếm đoạt ngôi báu của mình.
Vậy mà qua đây thì bảo ông hi sinh để bảo vệ 'con trai', chẳng khác nào cú vả đau vào mặt những người hâm mộ và kính nể vì lòng thương người của ông. Ông thương cảm Lucius vì ông đã nếm trải nỗi đau mất vợ con nên ko muốn nỗi đau đó lặp lại với bất kỳ người mẹ người cha nào khác, chứ ko phải tầm thường như máu mủ ruột rà nên mới cứu, còn nếu ko chắc ngoảnh mặt đi.
Tiếc cho bản hùng thi của phần 1 bị đem ra làm chiêu trò hút máu cho phần phim này",negative
29,CGI là thứ giết chết điện ảnh nếu lạm dụng.,negative
30,"Gladiator II là một sản phẩm không nên tồn tại ngay từ đầu. Một tác phẩm thể loại sử thi.....mà sai sử đến 90%, không nắm bắt được cốt lõi thành công của phần I mà lại mang kỳ vọng kế thừa nó. Cứ như rằng nói con ông hàng xóm phải giống ông chồng nhà cạnh bên??? Làm phim cho khán giả chứ không phải cho sử gia. Đúng, nhưng khán giả lại không thích điều đó. Thật đáng tiếc cho Ridley Scott, khi mà giờ đây tên tuổi ông đại diện cho sự ""ngu ngốc"" và ""ngạo mạn""",negative
31,Nói chung là muốn xem trọn vẹn thì bà con tốt nhất nên Bỏ Não ở nhà và đừng ham hố xem lại phần 1,negative
32,"Mình chấm 8 điểm. Đoạn cuối, khi đôi bàn tay lướt trên ngọn lúa mì, làm mình ứa nước mắt như sống tuổi thơ. Chỉ vì yêu thôi",positive
33,Ko hiểu gì nhưng thấy combat hoành tráng vãi,positive
34,Ít nhất đỡ hơn mấy cái phim Việt,neutral
35,Film mới thu đc hơn 200 triệu $ flop là chắc rồi,neutral
36,"Mình xem phần 1 tới gần chục lần, thấy hay, rất hay. Xem phần 2 thật sự thấy khiên cưỡng, diễn biến và lời thoại thua kém rất nhiều. Cảm ơn trang đã có những nhận xét đánh giá rất khách quan và truyền tải được nhiều thông tin tới người nghe. Cảm ơn rất nhiều!",neutral
37,"Chê mạnh diễn xuất phim này. 1/ Nhân vật chính diễn non quá, ko ra cái thần của chiến binh. 2/ Phản diện chính thì ko có động cơ, quá khứ gì rõ ràng, còn diễn các nét hiện đại, xem sượng trân.",negative
38,"Phim này xem giải trí tách bạch hoàn toàn với phần 1 thì còn tạm, chứ nếu mà xem với tâm lý so sánh với phần 1 thì chỉ có nản từ đầu tới cuối: nhiều chi tiết làm lố, hô hào khẩu hiệu sáo rỗng (như đoạn nv chính bị quật ngã ở đấu trường rồi cái speech ở cuối phim), motif bị lặp lại (bà Lucilla ủ mưu lật đổ vua), nhân vật thì xây dựng thiếu chiều sâu, thiếu thuyết phục, gượng, nhân vật thiếu động cơ (2 ô hoàng đế vì sao mà ác thế ??? Tại sao Lucius lại nhận đc sự kính trọng từ những đấu sĩ khác thế ??? (aura nv chính à), ông Acacius sao mà căm thù 2 ô hoàng đế thế, 2 ô ý ác thật nhưng có làm hại gì đến ông tướng này đâu ???",negative
39,"thích paul mescal từ normal people, và sau khi xem phim gladiator này xong thì vẫn khẳng định thích bạn này vì normal people 😂",neutral
40,Nói chung thua phần 1 nhiều,negative
41,"Xem lậu phim này đúng kiểu cực hình luôn, má ta nói trên mạng chỉ có đúng 1 đứa làm sub mà sub như sh*t mà trang nào cũng lấy sub đó hết",negative
42,Phần này dỡ quá tiếc thật 😢,negative
43,Đây là một bộ phim đầy tính nghệ thuật nên coi nó xong nhiều người sẽ không hiểu đc hết ý nghĩa của câu chuyện nên bài review này thật sự rất cần thiết cho người muốn đi coi bộ phim này ❤,positive
44,"Đã từng được xem các tác phẩm trước và trao đổi với anh Lân mới thấy được đây là một trong số rất rất ít đạo diễn hiện đại của Việt Nam thực sự hiểu điện ảnh là như thế nào. Dù hơi tiếc là phần lớn người xem Việt Nam chỉ xem phim như 1 công cụ giải trí nhất thời, mình vẫn hi vọng anh Lân sẽ được tiếp tục làm các dự án lớn và đi xa hơn nữa",positive
45,cảnh chú rể hát ở đám cưới thật sự ám ảnh tôi 😔,neutral
46,"Ngày xưa hồi bé thích nghe bà kể chuyện ngày xưa,lên cấp 3 nổi loạn lại bắt đầu ngỗ nghịch với bà, bà nói không nghe, bà mất được mấy năm rồi mà vẫn nhớ bà quá,giá mà ngày xưa đối với bà tốt hơn chút,dành bà nhiều thời gian hơn chút",positive
47,"bộ phim khá dễ xem, trc khi xem được xem 1 vài đoạn cắt nhỏ mình đã nghĩ đây là một bộ phim khó xem nhưng một phần vì phim ko quá nặng nề những shot quay không quá dài kèm với những câu đùa rất bất ngờ và rất duyên, lẫn những đoạn tự sự được anh Lân chăm chuốt nghe rất thơ. Thoại của phim thật sự rất hay, kèm thêm đoạn nhạc đất nước trọn niềm vui được phối lại nghe xong đã gợi cho mình 1 cảm giác gì đó. Ngoài ra thì dù các nhân vật có mâu thuẫn với nhau nhưng sức mạnh tình yêu cũng đã khiến họ thay đổi chấp nhận tin tưởng lẫn nhau, bỏ qua những khác biệt để hàn gắn tình cảm gia đình.",positive
48,Phim của bọn bắc kỳ ko thấm nổi ko xem nổi,negative
49,"Phim dễ xem, đồng thời cũng không quá đặc biệt, nếu trong nhà bạn có một người lớn tuổi hơn và một người nhỏ tuổi hơn bạn thì hãy dành thời gian nói chuyện với họ. Cùng một cảm xúc, thì hãy dành thời gian để hiểu hơn về những người thân thiết xung quanh, không cần phải xem phim này. Tìm hiểu rồi sẽ thấy cuộc đời những người xung quanh ta, có khi còn li kì hơn những nhân vật như bà Nguyện nhiều.",positive
50,"Vai gì khó, có Minh Châu. Ở Việt Nam hiếm có ai có thể thể hiện đầy đủ, trọn vẹn mà sâu sắc nội tâm phức tạp của nhân vật như NSND Minh Châu.Từng ánh mắt, từng hành động, từng thần thái, không hổ danh NSND.",positive
51,"Mn cho em hỏi có một cái âm ""Áhhh ""  của 1 người nam giới kêu lên như kiểu bị hạ gục(đại loại vậy)  xuất hiện nhiều trong phim mà em thấy đều cùng 1 âm thanh đó mà không hiểu đó là âm thanh gì mặc dù những phim đó ko liên quan đến nhau ,1 bí ẩn!!!!",neutral
52,Các diễn viên gạo cội diễn xuất vẫn chất thật đấy. NSND Minh Châu đã lâu không thấy cô diễn.,positive
53,"Ngược lại với sự tiếc nuối quá khứ một cách ám ảnh & buồn bã, mình nghĩ sự so sánh tâm lý trong bộ phim cũng chỉ mới là 1 góc nhỏ giữa 2 thời đại, mà thông qua đó, con người nên có cái nhìn về sự vô thường của cuộc sống, và bớt luyến tiếc những gì, thật ra chưa baoh thuộc về chúng ta.",neutral
54,Có ai thấy giống phim giòng sông không nhìn thấy như mình không? Có thể là do vẫn câu chuyện đấy phạm ngọc lân muốn làm lại,neutral
55,"em ấn tượng về phần hình ảnh lắm luôn, cứ siêu thực thế nào ấy nhất là đoạn ở đập thủy điện HB",positive
56,"Công nhận đôi lúc em cx nhớ về nhx kỉ niệm ngày xưa đã qua thật, nói j các ông bà mik :(((",neutral
57,"Phim Việt mà không có diễn viên hài gắn râu giả làm người già, không có diễn viên nữ chân mày ngang-mũi mọc từ trán-môi tiêm filler, không có diễn viên nam khoe múi, không khắc hoạ nhân vật người đồng tính xéo sắc mua vui, không có bài học đạo lý dạy đời thì không hay là cái chắc rồi 🤷🏻",negative
58,NHÌN CÁI MÀU PHIM THẤY NGHỆ RỒI,positive
59,"Mình may mắn được xem bộ phim này tại chính liên hoan phim Berlinale ở Berlin. Bộ phim khắc họa rất thật về những góc khuất trong cuộc sống đời thường ở Việt Nam, không khoa trương, không bóng bẩy, có một chút khắc khoải, ngột ngạt (ví dụ việc chọn tỉ lệ khung hình và gam màu đen trắng cũng đầy ý đồ), nhưng lại có chút gì đó hài hước, dễ chịu vì tuyến nhân vật ít, diễn biến cũng không quá phức tạp. Bạn trai mình người Đức xem xong thấy rất thích, nhưng bảo là phim u uất quá, về chắc trầm cảm mất mấy ngày. Nhưng mình thấy đó mới chính là thành công của phim, khi mang đến cho người xem những hỗn độn của cảm xúc qua góc nhìn rất điện ảnh. Mình nhớ lúc đó ở rạp toàn người Việt, nhưng cũng có nhiều bạn mang theo bạn bè nước ngoài như mình, và phim đã không làm mình thất vọng. Nên mình nghĩ mọi người nên đi xem phim để ủng hộ những tác phẩm như thế này. Phim có thể khó xem hơn phim thị trường, nhưng có giá trị ngẫm lại rất cao.",positive
60,Phim trắng đen ai coi .trả hiểu phim nói về vấn đề gì,negative
61,phim có nét rất giống văn bản nỗi buồn chiến tranh của Bảo Ninh đoạn miêu tả con người ta sau chiến tranh luon bị ám ảnh,neutral
62,đạo diễn VN toàn ra phim vớ vẩn.vn ta có bao nhiêu a hùng thời chiến tranh.ít có đạo diễn nào làm phim về chiến tranh.học hỏi trung quốc đi,negative
63,"Hôm qua mình đi xem về từ Ngày phim Việt Nam tại Đài Loan. Mình đồng ý với comment của một bạn nào đó là xem xong phải đọc mấy chục bài post và review thì mới hiểu về phim. Theo mình thì về màu phim, phối cảnh, và cách xây dựng câu chuyện khá tốt, mình xem mà cứ thấy khó chịu, ngột ngạt vì cái không gian trong phim, vì những phận đời như ""bên lề của xã hội"". Tuy nhiên, cách kể chuyện thực sự chưa được sâu, nhiều chi tiết lửng lơ thế nào ấy. Các diễn viên gạo cội đóng vẫn luôn hay, nhả thoại rõ ràng, cảm xúc. Các diễn viên trẻ thoại sượng, nhả chữ không rõ, diễn khá đơ. Mình cho 6/10 điểm.",negative
64,"tôi có cảm giác như hầu như đạo diễn việt đều muốn tỏ ra mình là người mang tầm vũ trụ, sánh ngang các đạo diễn tầm cỡ, xào nấu lại kịch bản theo ý mình nhưng như qq",negative
65,"em chưa đọc sách giấy nhưng mà em đã nghe truyện rồi, và thực sự là thấy phim không tới :<< em rất mong chờ đii xem nhưng mà suốt 2 tiếng xem e không có cảm xúc gì ngoài thấy cảnh phim đẹp hic :<< chắc là do e k cảm nhận được hay s nhưng mà nét diễn của các diễn viên e thấy không có tới, cảm giác cứ thiêu thiếu, lơ lửng như nào í  ( cả vai thuở bé với lúc lớn ):<< thật sự sau đọc truyện và sau khi xem phim xong nó là cảm xúc hoàn toàn trái ngược nhau, 1 cái thì nó thực sự đọng lại, 1 cái thì nó cứ trơn tuột đi hhuh .... Chỉ là cảm nhận riêng của em sau khi xem xong thôi ạ , hơi thất vọng nhiều xíu hic.",negative
66,"là fan của chú Nguyễn Nhật Ánh hơn 10 năm, sau khi xem xong bộ phim này mình chỉ nhận xét vài từ: Quay dựng đẹp, còn kịch bản quá tệ. Đọc truyện sẽ cảm được vì sao Vinh lại yêu và hy sinh cho Miền nhiêu như thế, sẽ thấy dc nội tâm của Vinh mạnh mẽ và cao thượng như thế nào. Còn trong phim không thấy được điều ấy, chỉ thấy rằng Vinh thật khờ , rụt rè và có phần yếu đuối.. Vinh trên màn ảnh và Vinh trên trang sách là 2 ng hoàn toàn khác nhau. Về các nhân vật khác mình cũng không muốn bàn luận thêm, vì nếu là fan của NNA chắc chắn sẽ nhận ra những điều ấy.",neutral
67,"Mấy phim làm về sách nguyễn nhật ánh k hay thật, k bao h đem lại cho mình cảm giác như 10 năm trước mình đọc cuốn sách đầu tiên của bác, phim làm quá công nghiệp quá nhạt nhoà",negative
68,cảnh với diễn viên đẹp quá nên quên hết tất cả,positive
69,"Phim xây dựng diễn biến nội tâm nhân vật như một trò đùa. Như kiểu xây dựng phim hướng tới đối tượng khán giả là học sinh cấp 3 vậy. Nhưng bù lại , hình ảnh và âm thanh thực sự làm mình thoả mãn, cắt vài đoạn rồi làm thành MV thì cứ gọi là tuyệt vời.",neutral
70,Phim chỉ 2 tiếng ko thể nào khai thác hết được hết 1 câu chuyện trong sách dc,neutral
71,"Đúng nha, phim làm hơi rời rạc, thua xa Mắt Biếc, người ta thích phim chỉ vì chuyện tình đẹp của truyện, chứ phim làm hơi thiếu quá nhiều..",negative
72,nói chung là phim như...,negative
73,Bé thì đọc đc nguyễn nhật ánh chứ lớn rồi thì ko thể đọc đc !!!!! Vậy nên t nghĩ sẽ ko có bộ phim nào chuyển thể có thể hay đc từ nguồn này ~,neutral
74,"Làm phim học đường chắc phải học hỏi nhiều Trung Quốc, vô cùng tự nhiên và gần gũi. Đơn cử là tác phẩm chuyển thể từ tiểu thuyết ""Năm tháng vội vã"", cả bản truyền hình hay bản điện ảnh.",positive
75,"Những người đã đọc truyện thì sẽ thấy phim fail như thế nào, nó rời rạc, đơn thuần là kể xuôi cái cốt truyện chứ chẳng làm người ta sống trong cái bối cảnh đấy và cảm nhận. Phần hình ảnh và âm thanh cố gánh cho bộ phim nhưng vẫn không xuể.",negative
76,Nguoi mien  nam lam phim chi duoc toi da 3/10 trong khi mien bac minh lam phim toan 9-10 diem,neutral
77,"Mình đã đọc qua truyện vài năm trước cũng lâu, rồi sau đó là xem phim đợt vừa rồi. Đồng tình với nhận xét của PP. Dù không nhớ quá rõ truyện 100 (do không đọc lại trước khi xem) nhưng lúc xem phim thì mình cũng chỉ thông qua phim nhớ lại được cốt truyện, một vài lớp cắt bối cảnh thôi. còn về nội tâm và sự phát triển của nhận vật mình không cảm được so với khi đọc truyện, diểm đó cũng thấy phim làm chưa tới với các lớp cắt thời gian thay đổi bối cảnh quá nhanh. Như nhân vật Vinh nội tâm và phẩm chất trong tình yêu rất đẹp cũng chưa được lột tả kỹ, phải nói là nông luôn á. Còn lại về hình ảnh thì đẹp, một phần do quay ở quê mình, PY lên màn ảnh đẹp mà nao lòng luôn. Ai chưa đọc qua truyện thì sẽ có cảm giác thoã mãn cao hơn những ai đã đọc qua tác phẩm của bác Ánh.",neutral
78,"mình thì cũng đã đọc truyện sau khi xem phim, phải công nhận là phim đã làm rất tệ trong việc phát triển nhân vật, nhiều đoạn bị cut rất khó hiểu như cái kết chẳng hạn, nó làm cho chúng ta thấy nhân vật trong phim có gì đó khá là tầm thường và bị động, đôi khi lại bồng bột. Nhưng thật sự thì mình lại khá thích phim vì phim có phần nghe nhìn làm rất tốt, các nhân vật diễn ổn, dù phim có nhiều điều chưa tốt nhưng nếu chỉ coi đây là một bộ phim độc lập tác biệt với tiểu thuyết thì mình thấy nó mang đến một trải nghiệm điện ảnh êm đềm, bình yên, chữa lành khi mà các vật, thoại, tình tiết đều đặt ở mức độ vừa phải chứ không bị đẩy lên cao trào một cách phi thực tế như phim một số phim Việt khác nên là cảm giác như bộ phim này có những tình tiết mà có thể gặp ở đâu đó ngoài đời, nó không bị quá ảo ấy. Và việc xem một bộ phim Việt có một số yếu tố mình vừa nói trên thì nó cũng làm cho phim có gì đó của sự thân thuộc. Mình nghĩ là nếu bạn chỉ đơn giản là muốn có một bộ phim xem để tìm thấy những phút giây yên bình, chill chill... thì đây là một trong những bộ phim đáng xem nhất trong nhiều năm trở lại đây của nền điện ảnh Việt",positive
