,Comment,Label
1040,T thấy giải trí mà s nhiều người khó tính thế nhỉ,neutral
1041,Coi vì mấy con 🐱🐱🐱🐱🐱🐱🐱🐱🐈🐈🐈🐈🐈🐈🐈🐈🐈🐈🐈🐱🐱🐱🐱🐈🐈🐈🐈🐈🐈🐈🐈🐈🐈🐈,neutral
1042,Với tôi vũ trụ marvel đã kết thúc từ end game,negative
1043,"Bộ phim này từ lúc chưa ra rạp đã biết cũng sẽ là 1 bộ phim tệ nữa của maver
 Đơn giản thôi . Ngay đến 3 nữ chính đều đc xây dựng 1 cách khá hời hợt . Câu chuyện của 3 nhân vật từ đầu đã ko lấy làm hứng thú gì . Nhìn vào diễn viên và cách họ thể hiện ở các phim khác là ng hâm mộ sẽ quyết định đc có nên ra để xem họ đóng ko",negative
1044,Phim chán vllllllllll,negative
1045,Tôi thấy phim nhạt :)) siêu nhạt đi tốn tiền,negative
1046,"Kết: bỏ tiền cho 90 phút, nhưng giá trị nhận đc là vài chục giây (mà cũng chưa chắc giá trị 😂)",negative
1047,Đến lúc DC ra hang kéo MCU vào lại chung =))),neutral
1048,Phim cho trẻ con xem :)),neutral
1049,The Flops :)),negative
1050,"Phim này rất xàm. Đọng lại trong trí nhớ của mình chỉ là bà captain marvel cực kỳ vô tri, đã ngu mà còn thích thể hiện, cái kết giải cứu hành tinh của Knee đc gảii quyết một cách lãng xẹt",negative
1051,Không phải ẻm toả sáng mà những nhân vật xung quanh quá mờ nhạt diễn tròn vai.,negative
1052,xem phim để xua tan mệt mỏi hay là thêm mệt mỏi,negative
1053,Phase 4 Loki gánh cả họ :)),positive
1054,"siêu anh hùng nữ quyền, da đen nữ quyền, teen girl nữ quyền, hồi giáo nữ quyền 😂",neutral
1055,"Phim tệ thiệt, được mỗi post credt scene. Mấy con mèo gánh còng lưng =)) Không thấy liên kết gì vs secret invasion",negative
1056,"Thường trên phim điện ảnh, thứ gì có sức mạnh vượt trội, đột biến thì trước sau gì cũng sẽ bị tiêu hủy hoặc bị kìm hãm lại trong diễn biến của phim. Điển hình như 7 viên đá vô cực, cuốn sách DarkHold và cuốn Vishanti, Captain Marvel cũng là 1 nhân vật powercreep nhưng do là SAH nên họ sẽ tìm cách neft lại",neutral
1057,"Thiếu iron man , Mcu nhạt hẳn",negative
1058,😂 nói thẳng là do đạo diễn quá kém cỏi,negative
1059,vì sao loki 2 lại hay ?,positive
1060,"Xem xong phim phải thốt lên ""LOKI ĐẠI ĐẾ""",neutral
1061,Thời gian phim ngắn lại giải quyết nhanh. Cốt truyện quá nhàm nên xem ko cuốn hút.,negative
1062,xem xong phim không hiểu gì hết! xem bao nhiêu phim chắc phim này chán nhất!,negative
1063,Phim như cái bầu đuồi,negative
1064,Bây giờ ở mavel thì chúa lừa làm bố của tất cả siêu anh hùng r,neutral
1065,"""The Marvel"" không phải là tên nhóm của 3 nhân vật chính trong phim này à? Mình nhớ có cảnh con bé Ms Marvel nó nói đang suy nghĩ cái tên cho nhóm mà ta",neutral
1066,"Ae có thấy cap mavels  bay đến hành tinh khác chỉ với một cái chớp mắt ( hàng chục năm ánh sáng- chó thể nói là nhanh hơn vận tốc ánh sánh  như Flash hoặc hơn).
Vậy  sao không thấy việc sử dụng quay về quá khứ hay làm chậm như flash",neutral
1067,Do phim hay do nhu cầu của người xem quá cao,neutral
1068,cực PHÊ =)))))))))))),positive
1069,"Tui ghét trò đổi hồn, đổi sức mạnh,...đúng là trò rẻ tiền",negative
1070,"Bản thân nhân vật Captain Marvel là 1 nhân vật cực kỳ, cực kỳ đáng thất vọng và lẽ ra không nên tồn tại
- Mang trong mình sức mạnh vô địch nhưng cách để có sức mạnh không được giải thích hợp lý.
- Có 1 cái tên đại diện cho cả công ty Captain Marvel. Tuy nhiên nhân vật không có lý tưởng, mục đích xứng đáng với nguồn sức mạnh. Thậm trí còn rất vô tri.
- Không có kết nối với các nhân vật khác.",negative
1071,nên dẹp kiểu làm phim này đi,negative
1072,"“Phép thử 270 triệu USD” hả kênh? Làm phim nhạt nhoà, cố gắng dùng kỹ xảo (tốn tiền) để bù nội dung, xong giờ lỗ. Bạn lại kêu “phép thử”, lại cỏn “bản lề” =))) cái phép thử và cái bản lề này của bạn có hơi QUÁ ĐẮT ko? LOL",negative
1073,"t chán ngấy xem mấy cái phim siêu anh hùng màu mè này rồi,quyết định k đi xem là đúng đắn",negative
1074,phim này mình đánh giá ms marvel đuối nhé. chưa khai thác được sức mạnh lắm. lại giống ai đeo nhẫn xanh rồi @@ đụt vãi,negative
1075,Trong dàn nữ thích nhất kate bishop,positive
1076,Thấy phim hay quá❤❤,positive
1077,Tui ghét mèo,negative
1078,"Thật sự thì trước giờ mình là một fan của marvel phim có bị chê chút thì mình xem vẫn thấy ổn nhưng đến khi ra rạp xem the marvel, sau một tuần mong đợi thì mình đã bị dội cho một gáo nước lạnh phim nếu nói quá tệ thì là hơi quá nhưng thật sự so với kì vọng là ổn của mình thì cũng ko tới. Hơn một tiếng trong rạp mình chỉ biết cố chịu qua hơn 1 tiếng và ôm người yêu và giờ cậu ấy đã thành người yêu cũ của mình",negative
1079,Có lẻ mình đã chán rồi nên tua nhanh phim giống làm cho trẻ em xem hơn.,negative
1080,"Phim M giờ cứ kiểu lấy yếu tố hài là chính. Những phim trong các năm gần đây toàn hài với hài ko còn mang bóng tối bí hiểm hay gây cấn nữa. Còn phản diện giờ cứ như cho có làm nền chứ k còn thâm hiểm nguy hiểm mang tâm lý nặng nề gây ko ít khó khăn cho nhân vật chính nữa.
Dần về sau mất đi chiều sâu của dòng phim siêu anh hùng nữa. 
Chưa kể quá nhiều phim nữ quyền làm cánh mày râu mất lun vị trí trong dòng phim siêu anh hùng.",neutral
1081,Tôi chả phải fan của ai hết. Cứ phim Maver hay DC ra tui đều xem hết 😂,neutral
1082,Ủa có phim này rồi hả 😂,neutral
1083,Đéo hiểu kiểu gì nhét toàn nhân vật nữ vào 😢,negative
1084,Cuối tuần t ra rạp là để giải trí nên cất não ở nhà. Nên trừ mấy cảnh diễn viên tương tác hơi ngượng ra thì phim này vẫn ổn. Với con sen cuồng mèo như t nữa thì 10đ😂😂😂,neutral
1085,Trong 1 vũ trụ mà chỉ cần bạn mặc đồ bó lâu ngày người ta sẽ nghĩ bạn là sah,neutral
1086,"Mình xem phim này ở rạp rồi. Thật sự là 5/10 thôi, ra khỏi rạp cảm thấy tiếc tiền vl=)) tất tần tật từ nội dung, kĩ xảo, diễn xuất hoàn toàn không có gì đáng nhớ hay ấn tượng, phải nói là chán òm ấy🙂 từ lúc nhìn poster phim đã thấy không hay rồi👎🏻👎🏻👎🏻",negative
1087,"Vẫn là công thức cũ từ hơn 4 năm trước để làm phim nhưng lại phản tác dụng vì ĐA VŨ TRỤ. 
Vừa hỗn loạn, vừa đọng lại những tàn dư của phase trước chưa giải quyết xong, kiểu như bình mới - cũ, rượu cũ - mới đủ màu đủ vị nhưng chất lượng kém. 
Chắc với những sự kiện từ Loki và X men hoặc 1 sự kiện nào khác sẽ reset lại cái ĐA VŨ TRỤ gọn gàng hơn, chứ không thà làm những series chất lượng xem cho dài.",negative
1088,Hình như chê cũng cũng phong trào thì phải =)) Tớ xem thấy hay mà toàn chuyên gia xem phim :))),positive
1089,"Dường như những nhân vật mang sức mạnh tầm vũ trụ như vậy mà chẳng có giải thích được quá trình đạt được sức mạnh đó, kèm với lý do, trách nhiệm chiến đấu. Tất cả chỉ đột nhiên bộc phát, như 1 người thường tự nhiên có tất cả vậy. Điều đó khiến cho mình cảm thấy tự hỏi liệu người đó có xứng đáng với sức mạnh đó ko",neutral
1090,"woke, nữ quyền, da đen",neutral
1091,"Marvel tập trung vào siêu anh hùng nam thì không thất bại vậy đâu. Cứ nữ quyền với da đen cho lắm vào, kể cả đạo diễn, thất bại xứng đáng",negative
1092,MCU muốn quay lại thời huy hoàng chỉ còn cách mời Tony stark về,negative
1093,"Sau endgame may ra có GOTG 3 vs phần nào doctor 2 là xem còn có cảm xúc, hứng thú. Còn lại chán quá",neutral
1094,"đang xem đc 1 nửa r, chả hiểu gì 😂. phim quá tệ, moidaden cho lắm vào",negative
1095,"ủa t  thấy xem giải trí cũng ổn mà,  các bạn đang trộng đợi vào điều gì vậy ?
=))",negative
1096,"đã từ 1 năm nay tôi bỏ xem phim Marvel, vì xem cảm thấy chán vãi. Kể cả phim Vệ Binh Dải ngân hà phần mới được tung hô là hay - tôi xem cũng thấy thường. Chưa nói đến mấy phim hạng B hạng C như Marvels này.
phim DC thì cũng đang không khá hơn. Nhưng The Flash còn khá hơn mấy phim Marvel rác gần đây. và DC có The Batman vẫn cứ là hay.",neutral
1097,"Ko phân biệt, nhưng phim giờ toàn nữ quyền coi chán hẳn. Nữ giờ đánh nhau còn gớm hơn nam. Coi chán chết.",negative
1098,sao làm chủ tịch park nhìn dìm thế tr @@,negative
1099,Phim xem PHÍ TIỀN ,negative
1100,Đạo diễn nữ chỉ vậy thôi,negative
1101,Combo đàn bà + siêu anh hùng = fail,negative
1102,"đúng là MV làm phim theo kiểu của họ, mà người xem về vũ trụ ko hiêu gì cả, người bình thường ko hiểu gì",negative
1103,Phim tệ vllll. Dở  nhân vật diễn quá tệ. Mọi người  Ko nên đi xem,negative
1104,"Phim hay vãi cả lìn, các bạn xem marvel vì cái gì, cái gì đưa bạn đến marvel, chính là nó, xây dựng chuẩn original thế r, chỉ có fan ngày càng khó chiều khiến họ p chạy theo lm khác đi, lm khác đi thì chê, CHỊU",positive
1105,"Chịu luôn mấy ô quan tâm đến đời tư người ta, chỉ vì nhiều phốt mà bỏ cả xem phim :))",neutral
1106,Dạo này marvel thử hơi nhiều😂,neutral
1107,"Trong chữ ""siêu anh hùng"" đã ghi rõ giới tính trong đó rồi. Thêm quả đạo diễn cũng là nữ thì fail là điều hiển nhiên.",negative
1108,"mình vẫn không hiểu vì sao khi Dar-Benn đeo 2 vòng thì ngỏm, mà Ms Marvel thì lại không sao",neutral
1109,"Cứ spam nữ quyền và mọi đen thì thế thôi,",neutral
1110,"Phim nhạt, nhảm, vô tri, vô cảm 😅",negative
1111,Rác rưởi :))),negative
1112,"sức mạnh quá lớn thật khó khai thác, như superman ấy",neutral
1113,"H chỉ hóng The Boys ss4,h không thẩm nổi phim của Marvel,có vẻ càng ngày càng nhạt!",negative
1114,Mấy đứa chê chắc là fan nửa mùa quá :)) chắc xem được mỗi Avengers rồi phán phim của Marvel tệ,neutral
1115,xem xong phim chả để lại cho mình đc cảm giác gì. Phim này thích hợp để nefflix and chill thôi :)) k xem cx đc,negative
1116,Bộ này như con cac í toàn khen,neutral
1117,Bộ  phim kinh dị hay nhưng tình tiết câu chuyện rối loạn ng xem không hiểu,neutral
1118,thế thì đúng là nên đọc chuyện. Ông ăn mày biến mất vì bị nghi giết ôg lão. đợi đủ 192 người vì dân làng lúc đấy chưa đủ 192 người,neutral
1119,Phim xem cute lắm luôn :)))),positive
1120,Mình không bt thế nào chứ mất tập đầu cuốn bao nhiêu thì mấy tập sau mình cứ thấy hụt hẫng thế nào ấy chả hay j cả( cảm nhận cá nhân của 1 người bình thường khi xem phim),neutral
1121,Tui hỏi xíu là diệt cả làng là 192 người thế con ông thập chết thay ông vậy 2 anh em nhà mây thì sao vậy có nghĩa là làng dưng à,neutral
1122,"mấy tập cuối như kiểu làm vội, qua loa....phải đọc comment của các bạn đọc truyện mới hiểu được, mấy phân cảnh cuối bố cục nhảy lộn xộn, đoạn quỷ canh rượu đi vào, mình xém phì cười, tạo hình quỷ canh rượu nhìn như con ma nơ canh, cái tủ gỗ trong nhà cháy lại có thể cứu 2 mạng người, mà 2 mạng người con quỷ không biết hay sao mà lại chấm dứt giao kèo với thập nương, cũng không nói rõ...mấy tập đầu thực sự rất lôi cuốn, mấy tập sau thì kiểu...ráng coi cho hết :v",neutral
1123,"Đôi khi mình xem phim mình cứ hay nghĩ đến những bộ truyện kinh dị , đặc biệt ở đoạn cuối . Nó hoàn toàn có thể trở lên đáng sợ hơn theo nhiều cách nhưng ở VN , nó vẫn là một cái gì đó bớt man rợ , nhân tính hơn rất nhiều để phù hợp với nhiều đối tượng",neutral
1124,Bộ truyện gốc là cả làng bị bạc tóc bởi thuốc chi đó của thập nương để thập nương kiểm soát số người bả giết với số dân làng nên mới có việc làng sinh đẻ không được thuận lợi nma trong phim không có tóc bạc nên cũng có hơi cấn khúc đó. Trong truyện thấy tội vợ tam quỷ vì em tưởng bả bị thập nương nhập để dang díu với ông kia nma chừ coi phim thì thấy bả có ý ngoại tình nên em cũng thắc mắc là bỏ sót ý nào của truyện không hay nlp làm z cho mọi chuyện êm xui qua hơn❤,neutral
1125,"quỷ canh rượu mặc dù có sức mạnh hơn tất cả nhưng khi xuất hiện thì như con rối bị giật dây khung hình rung lắc thực sự xem khá khó chịu và ko làm cho nó có cảm giác là sức mạnh thực sự mà nó chỉ là con rối bị điều khiển từ xa, phim đầu thì hay càng cuối càng dở",neutral
1126,"hơi hụt hẫng, lấn cấn 2 tập cuối",negative
1127,cốt truyện không bằng 1 góc truyện của trường lê,negative
1128,3 tập cuối làm như cho có.. xem chán dễ sợ,negative
1129,Chê gì thì chê nhưng chốt lại phim vẫn đang xem và có bước tiền đột phá với những nhà làm phim việt rồi,positive
1130,"dù phim đã được chính tác giả gốc tham gia, nhưng nhờ biên kịch để chuyển thể lên phim nên cốt truyện bị gãy và thiếu hẳn những phần hấp dẫn như nguyên tác, vẫn là sự yếu kém trong khâu biên kịch của điện ảnh Việt",negative
1131,"Thực tình mà nói thì....
Màu phim => xuất sắc
Bối cảnh => 10 điểm khỏi nhưng
Diễn viên => ổn áp...dù có mấy đoạn hơi cứng cứng
Cốt truyện => sẽ rất hay nếu không lôi hết giải thích ra từ đầu phim...
Và rút cục phim bị phần dẫn dắt làm hư hết....",negative
1132,đầu thì rõ hay về cuối xem cứ nhảm nhảm kiểu gì ý,negative
1133,Càn về sau càng A Đuồi...đang thắc mắc khúc cưới sao Tam bị gọi lên thuyền về cõi âm,neutral
1134,"mình đã đọc truyện và thấy cái kết thực sự hụt hẫng, cái kết thiếu quá nhiều thông tin và làm mất hết logic của truyện.",negative
1135,Phim giống mấy phim hàn nhỉ,neutral
1136,Số người chết trong làng kéo dài từ truớc rồi,neutral
1137,T đang thắc mắc là quỷ canh rượu sẽ lấy mạng của thập nương. Tại sao ông què k bị quỷ giết,neutral
1138,"192 người là giao kèo với quỷ canh rượu chứ có phải trùng với số người bị chết ở dòng họ Trương đâu, nói chung là phim chưa làm rõ được phải đọc tiểu thuyết gốc mới hiểu được",neutral
1139,"phim Việt như vầy là quá Ok rùi đó, hình ảnh  + bối cảnh đẹp, hoá trang rất ok. Còn nói về điểm mình chưa thấy ưng đó là diễn xuất, ngoài 2 NSUT và ông đóng chính ra thì thoại của các nhân vật khác khá cứng nhắc, như kiểu học thuộc bài ý, nhiều đoạn thoại còn thấy vô tri vô cùng.Chưa kể 1 làng từ thời nhà Hồ mà giọng Bắc, giọng Nam, giọng miền Tây đủ cả. Khúc đầu nội dung khá lê thê, khúc sau thì lại nhồi nhét.Xem phim xong mà còn quá nhiều thắc mắc luôn ấy\",positive
1140,"Kết lại sau 12 tập là 1 bộ phim nhàm chán, ko đọng lại được gì ngoài tình tiết nhạt nhẽo và mấy câu thoại giả trân",negative
1141,hay,positive
1142,"Kết không giống tiểu thuyết cho lắm, bỏ sót quá nhiều chi tiết, nói chung làm phim được như vậy là ổn rồi, nhưng mà vẫn thương Lão Què",neutral
1143,"Công nhận xem phim này hay thật sự . Lâu lắm rồi mình mới cảm thấy có một bộ phim kinh dị của Việt Nam mà có nhiều ấn tượng như vậy . Là 1 người đã từng nghe truyện của chị Bimbimbap Bắp khoảng hơn 1 năm trước thì mình cũng ko nhớ rõ chi tiết trong truyện lắm
Nhưng theo mình thấy thì lên phim nào cũng thế do giới hạn về thời gian và nhiều vấn đề phát sinh nên không thể làm đủ mọi chi tiết hay khai thác kỹ từng nhân vật được . Mà công nhận có nhiều nhân vật cần đc khai thác kỹ hơn như bà Tư mẹ của Hạch , mình thấy là bà này đóng rất đạt nhưng có những chi tiết cho thấy bà này tham tiền của rồi nhẫn tâm hại người trong làng và cả Hạch con gái mình mà vẫn chưa được phim cho thấy hết . 
Và vai Thập Nương hóa trang quá xuất sắc nhưng kiểu chỉ được lên phim lúc quan trọng còn đâu là ko thấy mấy . Mặc dù Lan Phương diễn rất hay . 
Xem tập cuối lúc Thị Thập và Thập Nương nói chuyện mà cười đau bụng nhìn cứ như hai chị em ma đang lên kế hoạch gì đó kinh khủng lắm .
Công nhận khâu hóa trang rất công phu luôn , nhiều khi nghĩ đắp 1 đống đồ lên mặt thế rồi mà còn diễn được vậy đã giỏi rồi chứ cũng không thể đòi hỏi quá mức được nữa .
Đã vậy điều kiện thời tiết thì lạnh rồi thiếu nước và điện mà đoàn làm phim vẫn cố để làm được như vậy đã thấy là tất cả mọi người trong đoàn đã rất cố gắng để tạo ra 1 bộ phim hay nhất đến với khán giả rồi .
Mong chờ bản chiếu rạp ngày 8/12 quá. Có ai mong chờ giống mình không nhỉ 😊?",positive
1144,"Đọ truyện đi, nhá hàng để kinh doanh phim nhựa thôi.",neutral
1145,2 tập cuối kỷ xảo quá chán luôn😢,negative
1146,"cá nhân em cảm thấy mấy tập cuối xem không được hào hứng như mấy tập trước lắm nhưng mà phải công nhận hình ảnh đẹp tốt thật sự ạ , mà em chưa đọc truyện em tò mò là đoạn ông què chỉ thế thôi ạ thật ra trước khi xem em nghe mọi người bàn về phim thì thấy lão què có vẻ cũng mạnh em nghĩ sẽ có một trận combat gay cấn hơn nhưng umm... em xem hơi hụt hẫng tí, với cả đoạn lão tam cuối cùng mọi người giải thích hộ em tại sao lão tam lại mất ạ có phải vì liên quan đến người vợ trước không ?",neutral
1147,Xem 3 4 tập đầu khá ok với nội dung gây tò mò. Tuy nhiên mình đã dừng lại và đọc truyện và sau đó cũng không có gì thực sự đọng lại. Cái kết quá dễ đoán và có phần nhịp đổ nhanh để cho xong cốt truyện. Và đến giờ mình cũng không xác định là sẽ xem phim :D,negative
1148,xem xong nếu có phần 2 quyết định sẽ k xem,neutral
1149,"Nhưng mình vẫn còn 1 câu thắc mắc rất lớn ngay cả từ truyện gốc. 
Ai có để ý hay có thể giải thích dc logic ko???

TẠI SAO THỊ THẬP LẠI BIẾT MÌNH ĐANG MANG THAI 3???

Lỡ là mang thai 1 hay thai đôi thì sao?
- Nếu là Thai 1 thì Lão Thập và Mây hoặc Đức sẽ phải chết thêm

- Nếu là Thai đôi thì hoặc Lão Thập hoặc Mây hoặc Đức hoặc Lão Tam phải chết thêm

Vậy làm sao Thị Thập biết mình đang mang thai bnh thai mà qdinh hi sinh để phá kế hoạch của Thập Nương đc????!????",neutral
1150,Theo mình thì đây là một phim Việt Nam rất thành công,positive
1151,phim như cổ tích Việt Nam. overrated !,negative
1152,"Đánh giá của mình là phần hình ảnh và góc quay, màu phim rất đẹp, nếu không nói tiếng Việt thì mình đã nghĩ nó là phim điện ảnh Hàn hoặc Trung kinh phí lớn. Trang phục và hóa trang tốt. Tuy nhiên đến cuối phim ngoài chi tiết hơi lỏng, mạch phim bị chậm còn kỹ xảo thì thô nhất là những cảnh lửa cháy. Hy vọng phần 2 sẽ hay hơn.",neutral
1153,"phim còn có phần 2 ạ,kết là kết mở cho phần 2 ấy là lão què lấy lại hồn cho tam qỷ á",neutral
1154,"Phần hình ảnh của phim mình đánh giá cao chỉ vì có những cảnh kinh dị thật sự, còn về phần hoá trang, góc quay cảnh kinh dị thì xin nói thật là không có chút nào đang sợ luôn.
Nội dung thì còn lan man, cách cư xử của nhân vật trong nhiều cảnh phim rất là ba chấm, từ tập 7 trở đi mình thấy nội dung tuột dốc không phanh và không còn chút hấp dẫn như trước khi về làng
Hi vọng sang phần 2 cải thiện hơn",negative
1155,"Ai đã từng nghe qua ngoại truyện Tết ở làng địa ngục thì sẽ hiểu thân phận của ông già què ( nữa người nữa sói) rất hay, nhưng có lẽ đạo diễn Việt Nam không quay được bộ phim đó đâu, chỉ sợ làm mất hình tượng ông già què",neutral
1156,cho em hỏi với mọi người e chưa đọc tiểu thuyết nên muốn hỏi tại sao tam quỷ cuối ss1 lại chết thế ạ 🥲🥲🥲🥲,neutral
1157,Nên cảm thấy vui vì nó là bộ phim đầu voi đuôi chuột. Vì những bộ phim còn lại toàn đầu chuột đuôi chuột,neutral
1158,"Trong truyện giải thích rất rõ ràng, vợ 3 quỷ cặp với 4 cháo lòng là do 10 nương sai khiến để dùng sắc dục phá đi lò rượu fake. Thập nương vào làng lúc bà nội của Thập là bà Phong lúc ấy đang còn là bé gái, trong gần ấy năm thập nương dùng đàn đom đóm và vu thuật để giết bớt và khống chế số lượng nhân số của làng. Và trong truyện có thêm lão mục đồng làm nghề bắt rắn ( phim ko có ) câu chuyện lão kể với thập trưởng làng hầu như giải thích 80% những cái chết bí ẩn ở làng. Và lý do duy nhất khiến ông trưởng làng xuống núi được là do ước hẹn năm xưa giữa bé Phong non dại và oan hồn hận thù của thập nương, Phong và con cháu của bà được xuống núi và thập nương bước chân đầu tiên vào làng bằng cách nhập xác vợ cụ Khảm",neutral
1159,Cơ bản là do làm thêm Kẻ ăn hồn nên ko thể giải thích chi tiết ở tập cuối đc đó mn.,neutral
1160,Truyện gốc hay hơn kể hết những vấn đề thắc mắc,negative
1161,"Hay phải khen là
Rất hay . Theo
Mình ekip quá nỗ lực và nsx đầu tư tốt",positive
1162,Ông Thập phế quá:((,negative
1163,Công nhận là sau tập 5 bắt đầu thấy lê thê dài dòng. Nhịp chậm khác với việc bôi ra trong khi còn rất nhiều chuyện để kể,negative
1164,"thứ ám ảnh trong phim kinh dị không phải ở chỗ hóa trang, khi nhân vật show sự máu me như thế nào, mà là sự man rợ,",positive
1165,Phim... Nhìn vào là thấy bản sắc Việt Nam.... Có kết mở... Zax là quá tốt rùi....,positive
1166,"Có 2 điểm phải chê ở bộ phim này. Thứ nhất là ánh sáng, thứ 2 là 1 vài chi tiết lặp đi lặp lại như bài đồng dao hay câu mượn hồn trả hồn gì gì đó . Cái kết hơi có vấn đề không biết vì sao lão què vẫn sống sau khi luyên rượu mà thập nương lại bị quỷ rượu táp",negative
1167,"Phim thì có đột phá hơn so với những phim khác, nhưng nhiều đoạn mình xem cảm thấy ức chế và chưa đủ thỏa mãn khi câu truyện đưa ra rất nhiều dữ kiện những không giải quyết dc hoàn toàn, xem đến cuối vẫn còn thắc mắc. =))) mà mình chả hiểu sao, làng thì bị quỷ ám với giết hết mà chính dân làng lại chẳng có nổi một giải pháp nào để chống lại nó mà từ đầu đến cuối chỉ là sự lo lắng, sợ hãi, nghi ngờ chém giết lẫn nhau. Sau 1 án mạng, đáng lẽ mọi người nên tìm 1 nơi để ở chung, để ít nhất nếu ma quỷ lại tìm đến thì còn kịp thời giúp đỡ nhau, thì lại ai về nhà nấy :))) , dù biết là làm phim dựa theo nguyên tác nhưng mình thấy rất bực bội ấy",negative
